user_id,talent_id,rating,review
80608aac-af0e-40c5-ab60-1837f836ac45,60c8d4e3-f0da-44f8-a6c8-452fb50ce4e1,5,"Sebagai dokter dan pengusaha, talent ini membawa perspektif unik dalam diskusi. Saya sangat terinspirasi dan belajar banyak."
b6380a45-b52f-4f17-b3ca-10b5177abd61,f43738a5-0c1d-4fcc-91e3-988ba07e8188,3,"Kreativitas talent ini terlihat jelas dalam seni ilustrasinya. Sayangnya, kurangnya interaksi sosial dalam diskusi membuatnya agak kurang menarik."
fdd8d6b3-367e-4c6a-b375-c1ad40fbcbec,4c4974df-9563-452a-bda5-586a291a8547,5,"Diskusi dengan talent ini sangat memikat! Filsafat dan seni menjadi kombinasi yang menarik, memberikan wawasan baru dan menyenangkan."
a3ae4fd1-f1fe-4a5d-8b56-9b3b3325bb95,deadbcb3-0965-4734-8e7b-7e7262c85545,4,"Sebagai seorang koki, talent ini sangat kritis terhadap rasa dan presentasi makanan. Pengalaman memasak bersamanya luar biasa."
ed3219e0-9e8e-44ed-8fc7-ab198b1fa251,a30f6183-4292-4f2e-98d2-40066b2e2dd9,3,"Sebagai perawat, talent ini memberikan perspektif kesehatan yang berharga. Namun, kurangnya keahlian dalam teknologi membuatnya terbatas."
23d54e8e-5289-4136-8a6c-4ef3969b5c51,4f0a8997-c297-4546-9e2b-fcd533e6507c,5,Kombinasi mendaki dan gamenya membuat talent ini sangat menarik. Diskusi dengan mereka selalu penuh semangat dan menyenangkan.
f21d0fc4-eb6e-45e0-9189-4450bc1600cb,4f0a8997-c297-4546-9e2b-fcd533e6507c,4,"Diskusi dengan talent ini, seorang perawat dengan minat dalam teknologi, membuka pandangan baru terhadap kesehatan modern. Sangat informatif!"
29a85ac9-3d14-486b-80d9-277948bdeb53,7cef8e39-2317-45a3-9db7-e15230ab5c12,2,"Saya mengharapkan lebih banyak ide inovatif dari talent ini yang tertarik pada teknologi dan musik. Namun, diskusi kami agak datar."
f5072661-e988-42ff-8359-7d9ce0831a40,5b9fcb34-7903-4c68-8ca1-1e4b5c984d56,5,Dokter yang suka mendaki dan berselancar! Diskusi dengan talent ini sangat memotivasi untuk menjalani gaya hidup aktif dan sehat.
294f1d2a-364e-4a4b-be34-3fc1c4f8839c,50df03a0-4522-4908-940e-8f638c6eb77d,3,"Arsitek yang suka melukis, talent ini memiliki keahlian artistik yang luar biasa. Namun, diskusi kami kurang fokus pada topik tertentu."
ee0e85ec-5cae-4cf5-b483-879dc2ef7a49,fc2e42d4-d372-4975-9a32-bee337e9fcca,4,Seniman kreatif dengan latar belakang desain dan tarian. Diskusi kami penuh energi dan penuh ide-ide segar.
345ac507-4755-4016-945d-7d80e6b3651c,60f3a9d4-bb91-4c5a-a6b5-707fc70d3c5f,5,"Sebagai penggemar alam dan pemandu wisata, talent ini membuat pengalaman diskusi saya menjadi seperti perjalanan virtual. Sangat menghibur!"
303e5b40-e17e-452d-ba2b-86de8f67d2a9,bf2cd5f5-4486-4b1d-97f1-65a1a8e1ad0f,3,"Kreatif, pengajar, dan perfeksionis. Talent ini memberikan wawasan mendalam dalam diskusi, namun terkadang terlalu fokus pada detail."
c26de0df-dbba-4029-847e-24ca7289e894,bfae1619-dac3-4082-bea8-8625548ac43a,4,Pengajar dengan minat dalam futsal dan jogging. Diskusi santai dan informatif. Saya senang mendengarkan ceritanya tentang kegiatan olahraga.
905cb00b-e5ee-4a7c-bd93-eadd0b3c462c,ff456af0-73bb-4b8c-8ad0-9ba690c1940d,5,Sejarawan yang suka diskusi dengan pengalaman sebagai pemandu wisata. Kombinasi yang menarik dan membawa sejarah hidup dalam obrolan.
ec7c6036-9558-4498-a8da-2d06e4eaa444,2a0135f5-d942-4d8a-a358-924a17fe91ec,2,"Seniman independen dengan minat pada grafis dan desain. Sayangnya, diskusi kami kurang interaktif dan kurang memahami antara satu sama lain."
0e3b0dfb-5b9a-47a3-8593-75407446706a,89f5bf65-aa1c-4b74-9a82-cdc3ab861d31,4,Diskusi yang menyenangkan dengan atlet binaraga! Saya merasa termotivasi untuk menjalani kehidupan yang lebih sehat setelah berbicara dengannya.
41d52c04-6f38-4088-8ce6-5bd1cabe2f47,a009eab5-83ab-4fce-b087-522c09750334,5,"Diskusi dengan talent ini membawa kegembiraan dan keceriaan. Kombinasi humor, fashion, dan sejarah membuatnya sangat menarik."
e338a072-14bf-45fb-8b5e-18a1903af5eb,c20b68ea-920d-4370-b86f-7b644f2514c7,3,"Programmer yang tertarik pada musik dan kreativitas. Diskusi kami agak teknis, tetapi saya belajar banyak tentang industri musik dan teknologi."
c2e2d6c5-d06d-4d10-8085-ada96e8d68d8,1fdce70b-cf23-497e-9658-6d07f1c568e5,4,"Poker dan bisnis, talent ini memiliki wawasan keuangan yang menarik. Diskusi kami penuh dengan tips dan trik untuk mengelola keuangan pribadi."
93b57bfc-ea29-4726-be9c-7af6ff663591,8a126c7b-014b-42c6-b773-a8d553b49801,5,Diskusi dengan talent binaraga yang juga penata rambut! Kombinasi yang unik dan membawa perspektif yang berbeda dalam kecantikan dan kesehatan.
8fb73da8-e4a4-485a-998b-15045d293d30,a009eab5-83ab-4fce-b087-522c09750334,3,"Pialang saham dan traveler, talent ini memberikan wawasan tentang pasar keuangan dan pengalaman perjalanan yang seru."
4748738d-bc36-407b-9efc-0f2928cb4bc4,e5da7b1e-c492-4f2b-9276-52bc6e116e3c,4,Musisi dan komposer dengan visi yang kuat. Diskusi sangat kreatif dan memotivasi saya untuk mengejar passion saya dalam musik.
a1503955-f6c1-4e2a-bd6f-d2eff31ed3d6,e78110d2-feae-4802-81f5-dc226efdfd6e,5,Diskusi dengan talent komposer yang juga suka bermain kartu. Pengalaman luar biasa dan memberikan wawasan unik tentang kreativitas dan keberuntungan.
f37a0a6e-d4ca-4d45-b77c-eda992a84859,42098ead-e940-4a23-b1d8-295d72e78522,3,"Diskusi dengan geolog dan peneliti. Meskipun topiknya terkadang kompleks, talent ini memberikan penjelasan yang mudah dimengerti."
3fcc4cd9-2d8b-4dbc-b165-847fdd125829,d6a6bbdc-2d78-4a70-85bf-2f2319002ac1,5,Editor dan cosplayer dengan kepribadian humoris. Diskusi kami sangat menyenangkan dan penuh tawa. Sangat merekomendasikan untuk pengalaman yang menyenangkan.
f2c2650a-6ffc-4b3c-a89c-5bd2ebc16104,e71d690c-52f6-443a-9110-ef1bb1fb2ded,4,Talent ini sangat inovatif dan kreatif. Saya suka cara dia memadukan fashion dengan teknologi. Karya-karyanya selalu menarik!
bad6ab38-3450-4e8b-a9d8-2bf01c941c51,e1728725-672b-49ca-b2ef-09e91aab4adb,5,"Hebat! Orang ini tidak hanya ahli dalam coding dan teknologi, tetapi juga memiliki bakat luar biasa dalam sepak bola. Sungguh mengagumkan!"
fd80b5c2-9504-4cc3-b9fd-a2bc3e52fe45,2868823c-eedb-4dbf-9e98-75e71801a8a6,4,Sangat romantis dan kreatif. Kombinasi coding dan talenta di bidang teknologi membuatnya menjadi programmer yang handal. Karya-karya cintanya istimewa.
d5fcb908-ef28-464d-bf2d-a67222a9e66b,110ca178-ecd9-4051-88ec-ca6895adcc19,3,"Talent ini memiliki pengetahuan mendalam tentang ahli nutrisi, dan saya suka cara dia menyajikan informasi dengan gaya animasi. Hanya perlu lebih banyak variasi konten."
60b7818c-1edd-4354-9a0f-2b04459c9510,65246c1c-271d-4b47-b9fb-b646b2a44576,5,"Sangat mengesankan! Coding, inovasi, dan keahlian teknologinya membuatnya menjadi programmer yang sangat baik. Saya tidak sabar untuk melihat lebih banyak karya dari talent ini."
01e94735-a85d-4a63-8d1b-1945078bd170,f7d19853-608b-4f77-807d-2e3b88afb36b,4,Talent yang sabar dan patriotik. Kombinasi musik dan keahlian mengajar membuatnya menonjol. Ramah dan menyenangkan untuk bekerja sama.
152cd698-f134-43ad-a351-80debc1471ee,ed9fe31a-7af6-4d52-b397-add9fb2dd7a5,3,Pengalaman kuliner yang luar biasa! Mampu memasak dengan cerdas dan disiplin. Hanya perlu sedikit variasi dalam kontennya.
082cdc30-a2e4-47b2-a225-a8f1aedfe5d3,de873eec-847b-4807-a67d-c1c63ea5c0d0,4,Berkuda dan bisnis menjadi kombinasi menarik dalam bakat ini. Visioner dan konsultan yang independen. Pengalaman bersamanya menyenangkan.
a0b09d32-bb32-4472-8ca1-1e350a603427,5a84cfab-2a96-4c5c-a741-4e9da4b884b8,5,"Cerdas dan peduli. Pengajar dengan kemampuan menyelam yang luar biasa. Seru belajar bersamanya, saya sangat merekomendasikan!"
85fccddd-bc6a-403d-a447-a0362d5718a3,cbd630af-38c0-4f8b-a64d-53529d01a18f,3,"Menyenangkan berdiskusi dengan talent ini. Tidak hanya disiplin dan perfeksionis, tapi juga sangat ramah. Hanya perlu lebih banyak variasi dalam topik diskusinya."
80014d9c-8036-4ee7-8c72-940caa03d686,f13cbfe4-b6ad-4e49-b2c2-e56b197b8407,4,"Diskusi dengan bakat ini sangat memuaskan. Visioner, bisnis-savvy, dan sangat kreatif. Saya suka cara dia merinci ide-ide kompleks."
44de7c71-64b8-4455-b443-b111b2651e38,83feee56-1ad7-4bc1-bdb6-af716bc96d0c,5,Sutradara yang luar biasa! Bakat ini mampu mengarahkan adegan dengan sangat baik. Kombinasi akting dan kreativitasnya sungguh mengesankan.
da56caa2-6a2c-409b-b8f7-6ce3c4239e2d,82be1c14-f2dd-43ed-87c4-bcb1e787be3d,3,Ilustrator yang sangat berbakat. Saya suka cara dia menggambarkan berbagai konsep dengan sentuhan seni yang unik. Hanya perlu lebih banyak variasi dalam gaya ilustrasinya.
92cec973-b90c-43a8-98f4-23df85809a30,89e8b4a5-7e58-49d7-8887-8bde718435d5,4,Ahli biologi yang juga seorang seniman! Kombinasi unik yang menciptakan karya seni yang indah dan informatif. Saya merekomendasikan talent ini.
31e14bf9-c540-4176-9419-68301acee5a0,ccf1a63a-b389-440e-9c62-f167cbcbf68c,5,Talent yang luar biasa dalam menggabungkan humor dan kreativitas. Sangat memikat dan selalu penuh semangat. Saya sangat senang bekerja sama dengannya.
4fbecc9d-043c-45d6-93b8-547841fcbe60,281540a7-fdbf-4d07-845c-df8e95278a98,3,Talent ini memiliki keahlian yang unik dalam kuliner dan poker. Kombinasi menarik yang membuatnya menjadi pilihan yang menyenangkan untuk bekerja sama.
7a7fa98b-8ab3-43de-824f-098219de5df3,84e3e587-ec6c-489d-9e11-81f11af5b36b,4,Penuh semangat dan kreatif. Suka cara dia membawa energi ke dalam berbagai proyek. Hanya perlu lebih banyak variasi dalam kontennya.
be68d4c9-5fda-4c8a-9f4f-aa2b594d7849,f13cbfe4-b6ad-4e49-b2c2-e56b197b8407,5,Romantis dan berbakat musik! Hang Out bersamanya selalu menyenangkan. Saya merekomendasikan talent ini untuk hiburan berkualitas.
b62a6928-02a7-40f5-8268-97ac3f3e7d5b,fe095641-bdc3-40ed-892e-6f485d9eacd7,3,"Berpikir kreatif dalam memadukan puzzle dan badminton. Kombinasi yang menarik, tapi perlu lebih banyak variasi dalam konten."
b2b461cb-05c7-4f11-ac7a-b390a5200656,87ab9b72-a368-4f1f-b62e-deb71d03de32,4,Pemandu wisata yang berjiwa petualang. Hang Out dengan talent ini selalu menarik. Saya merekomendasikan untuk pengalaman yang tak terlupakan.
bba5f8b9-a074-488e-907c-73adfb134f88,fe74e622-43c9-4715-825a-034199bd48af,3,Belajar dan mengajar kombinasi yang efektif. Suka bagaimana talent ini menggunakan sosmed untuk berbagi pengetahuan. Hanya perlu lebih banyak variasi dalam topik pembelajarannya.
4696f38d-2ad3-48ca-b4b7-84360ac66c6a,1dc02527-ebe6-44ff-b900-cd5fb296d7be,4,Hang Out dan gaming! Kombinasi yang menyenangkan dan seru. Saya merekomendasikan talent ini untuk waktu bersenang-senang.
6dfcd862-ebe6-4b0f-b059-a7b523ab325b,2a0135f5-d942-4d8a-a358-924a17fe91ec,5,Videografi dan editing yang luar biasa. Talent ini mampu menciptakan konten multimedia yang menarik. Saya sangat merekomendasikan!
cf4011a7-ba93-4f98-a5aa-0c9359cfa352,d7d013a3-c4f5-4777-b51e-b4b10739a0d0,4,"Filsafat dan membaca, talent ini memiliki keahlian unik. Diskusi bersamanya selalu penuh wawasan. Saya merekomendasikan untuk pengalaman berpikir yang mendalam."
2a0adecb-08e7-4504-8288-afa0c10e77c3,f9b93b0f-db1b-4613-8767-292b7e29e9c9,3,"Berpikir inovatif dan terorganisir, talent ini memiliki kombinasi unik dari berbagai keahlian. Jalan-jalan dan memancing bersamanya selalu menyenangkan. Hanya perlu lebih banyak variasi dalam kegiatan."
e41c3c2b-0e1a-4db5-b633-3125629ccf2c,03e20191-6827-473e-9ebc-444962d6456a,4,"Penuh energi dan berkebun, talent ini sangat menyukai aktivitas luar ruangan. Kolaborasi berkebun dan dubbing bersamanya membuat pengalaman berbeda. Saya merekomendasikan talent ini untuk kegiatan menyenangkan."
38339d70-c741-46a3-82d2-00d1d62f1e27,e557270c-fe36-455f-b9a7-ba5b478b8254,5,"Coding dan geologi, talent ini memiliki pemahaman mendalam tentang teknologi dan ilmu bumi. Kombinasi yang unik dan berharga untuk pengalaman belajar. Saya sangat merekomendasikan!"
dce9bb10-5816-4ecb-adb8-b2b141f889fc,4ec23f2d-65d8-4446-9b3d-dc1c8177e296,3,"Desain UI dan pengajaran, talent ini memiliki kreativitas tinggi dalam desain grafis dan multimedia. Menambahkan sentuhan desain pada berbagai proyek membuatnya menarik. Hanya perlu lebih banyak variasi dalam topik pengajaran."
9744a842-1b56-4b97-acf4-5690dd08af5f,d7d013a3-c4f5-4777-b51e-b4b10739a0d0,4,"Humoris dan berjiwa sosial, talent ini menjadi pilihan yang ceria untuk dihadirkan dalam acara atau proyek. Saya merekomendasikan talent ini untuk memberikan nuansa positif."
31776071-73ac-4b96-b45d-02b016d303ef,5806eb15-0473-44da-b626-d475a8632750,3,"Kesehatan dan bekerja, talent ini memiliki pengetahuan tentang kesehatan dan kebugaran. Kombinasi ini membuatnya menjadi pilihan yang baik untuk memberikan wawasan tentang hidup sehat. Hanya perlu lebih banyak variasi dalam aktivitas bekerja."
67664a85-7692-4576-9e3e-09f657816c64,c6ae2bb0-c5e7-4c1f-be87-df1e26d03409,4,"Bisnis dan desain interior, talent ini memiliki kombinasi unik yang menciptakan proyek-proyek menarik dan estetis. Saya merekomendasikan untuk pengalaman bisnis dan desain yang berkualitas."
8d22eebf-0937-45c8-b81c-eef2598646db,c9195b81-3728-4279-8838-e39a55975e34,5,"Pecinta alam dan berenang, talent ini memiliki ketertarikan pada alam dan petualangan air. Bersama talent ini, hiking dan mendengarkan musik menjadi lebih seru. Saya sangat merekomendasikan!"
61d2ad35-1481-4b0d-b1e1-f607806204fe,fb8b5217-0ddd-41b2-9224-57c9d933f1f0,3,"Puzzle dan psikolog, talent ini menciptakan teka-teki kreatif dan memiliki pemahaman mendalam tentang psikologi. Kombinasi ini membuatnya menjadi pilihan yang menantang. Hanya perlu lebih banyak variasi dalam teka-teki."
5be866f7-6d93-465b-9dd0-8443e818ae67,e67e4248-e452-49f2-b0c8-540a3949c388,4,"Hang Out dan binaraga, talent ini menciptakan suasana yang menyenangkan dalam kegiatan olahraga. Bersama talent ini, permainan dan olahraga menjadi lebih intens. Saya merekomendasikan untuk pengalaman bersenang-senang."
1a836ee2-0cfb-48cf-b4a4-17a0d6c8d77d,d92bdb5b-2540-4013-b423-b3f8c24449ef,3,"Billiard dan poker, talent ini ahli dalam permainan kasino. Kombinasi yang menarik dan menyenangkan untuk malam-malam santai. Hanya perlu lebih banyak variasi dalam permainan."
d8e96972-d69f-4243-b0ff-2c7330be15ee,e48453b0-1697-4ff7-ab78-f7712a84e6ec,4,"Film dan melukis, talent ini memiliki keahlian dalam seni dan perfilman. Karya-karyanya unik dan penuh ekspresi. Saya merekomendasikan untuk proyek seni dan film."
fb971acd-19b3-40aa-b864-0353c97a92f0,a30011f6-eb60-414a-ae57-e83afd3429a8,5,"Belajar dan bersepeda, talent ini menciptakan pengalaman belajar yang menyenangkan dan aktif. Saya sangat merekomendasikan untuk aktivitas belajar yang dinamis."
c6bd548d-2d55-49b1-b2ce-83f336f0fc3b,70b8125a-c8d5-4e59-af64-2e95ee7f09bf,3,"Puzzle dan diskusi, talent ini menciptakan teka-teki yang menarik dan membangun diskusi yang berarti. Kombinasi ini membuatnya menjadi pilihan yang menantang. Hanya perlu lebih banyak variasi dalam jenis teka-teki."
7af0e135-cbb1-4e45-b391-dadf18febbcc,d73ba380-5e20-4e9b-b15e-6ea8be31d724,4,"Poker dan pengusaha, talent ini memiliki kombinasi bisnis dan permainan yang menarik. Diskusi bisnis dan malam poker bersamanya menjadi lebih seru. Saya merekomendasikan untuk pengalaman unik."
31535454-15dc-4e43-9de4-b02f154b02b8,7f82311f-0bc1-43cb-87e4-d1faa0a92e76,3,"Kecerdasan buatan dan hiking, talent ini memiliki pemahaman teknologi tinggi dan ketertarikan pada petualangan. Diskusi tentang kecerdasan buatan sambil hiking bersamanya sangat menarik. Hanya perlu lebih banyak variasi dalam topik diskusi."
d3e051c6-99b1-4d00-b3e9-ef753b7b48b3,dae5ae9f-4dbb-43c9-843f-e109ad56f556,4,"Gamers dan kerja, talent ini memiliki keahlian gaming dan bekerja yang hebat. Bersama talent ini, gaming menjadi pengalaman yang lebih seru dan bermanfaat. Saya merekomendasikan untuk sesi gaming yang menyenangkan."
ffd00e24-62ec-42fe-943f-0fb50afe10b6,4ea4adc0-b279-496d-ace1-b6035a7d80d6,5,"Coding dan astrografi, talent ini memiliki pemahaman mendalam tentang teknologi dan keahlian dalam astrografi. Kombinasi ini sangat menarik dan bermanfaat. Saya sangat merekomendasikan!"
13f7fee1-a564-43bb-b0b1-fedfe18d33df,698f855c-536d-4636-835a-c1d3d8d21990,3,"Sepak bola dan gamers, talent ini menyukai olahraga dan gaming. Bersama talent ini, olahraga dan gaming menjadi lebih seru. Hanya perlu lebih banyak variasi dalam jenis olahraga dan game."
f7cb6a6e-baff-457c-9d20-55f6aa21d316,8d68a99c-7644-4d2e-9c0b-9054ae202c38,4,"Pengajar dan independen, talent ini memiliki keahlian mengajar dan berdiri sendiri. Diskusi dan proyek bersamanya menjadi lebih inspiratif. Saya merekomendasikan untuk pengalaman belajar yang mendalam."
2d9ab3da-30e8-4fb0-a447-015f19a1aeb4,5d2c5bf2-6965-4cc6-8732-10afe80d995f,3,"Belajar dan diskusi, talent ini menciptakan suasana belajar yang interaktif dan inspiratif. Diskusi bersamanya sangat mendalam. Hanya perlu lebih banyak variasi dalam topik diskusi."
4f106c88-973d-40b3-a8f5-f3e7a35f0d9d,3230c4b0-ba0b-4590-8435-5e837b1f1ee7,4,"Pemandu wisata dan hang out, talent ini memiliki keahlian dalam mengatur perjalanan dan menciptakan suasana hang out yang menyenangkan. Saya merekomendasikan untuk pengalaman perjalanan yang berkesan."
db41055e-5718-43f6-a89b-90aa2a854457,f34bf80f-11c7-4e58-90cc-a056e190bba3,3,"Bersepeda dan komposer, talent ini menciptakan pengalaman bersepeda yang dinamis sambil menikmati musik yang diciptakannya. Hanya perlu lebih banyak variasi dalam jenis musik."
7e4369fe-b111-46f3-96ff-ab268572acb4,3af93772-2cb0-4e98-85eb-37ea1eb79958,4,Talent ini sangat mengesankan! Kombinasi antara kecerdasan astrografi dan intelektualitasnya membuat setiap sesi dengan talent ini menjadi pengalaman yang tak terlupakan.
9d1f3f6e-ef91-420f-983f-ea7401e9f0e4,0baf74b8-93aa-4b0f-ac7b-fc83e53fff2e,5,"Saya tidak bisa lebih puas dengan keahlian kuliner dari talent ini. Setiap hidangan yang dia buat adalah karya seni, dan saya memberikannya nilai maksimal!"
702f4df7-8478-4ebc-9d48-dec41bea82ff,61601bd4-79b7-4399-b6b3-4bad407c2e06,3,"Saya suka dengan kemampuan fashion dan model dari talent ini, tetapi mungkin ada sedikit kesenjangan antara minat saya yang lebih condong ke astronomi."
cd96192d-4c2b-49e1-9979-58fcacbd388e,7569cad6-a50b-43d0-a6f6-767eeca6c78b,4,"Talent ini tidak hanya ahli dalam menyampaikan pelajaran, tetapi juga memiliki kecerdasan yang luar biasa. Pelajaran bersamanya selalu menyenangkan dan informatif."
39ffe3b6-2227-4b25-a59d-2bd04a573a5a,0aed5cdc-c51b-41ca-9c9a-48d6c7ae70d5,5,"Sangat kreatif dan penuh semangat! Talent ini tidak hanya menulis dengan indah, tetapi juga melibatkan pembaca dengan ide-ide briliannya."
b386a94d-41f0-4cfa-9735-fdf682f3d101,68800989-fa3a-414d-93ba-2fc41eeb7c36,4,Saya sangat terkesan dengan kreativitas talent ini dalam desain. Penggunaan warna dan bentuk sangat menarik dan mengundang untuk dinikmati.
8d996a43-2236-4273-88f2-325b26af8de7,e2d93ab6-e078-4309-8793-b5ee22ca50a7,3,"Talent ini memiliki visi yang besar dalam dunia film. Namun, saya rasa ada beberapa aspek teknis yang dapat ditingkatkan untuk membuatnya lebih sempurna."
3792588c-9b9c-4aa2-a6d4-8ac3f1c2e927,c8e4b98b-68fe-4a30-9b7a-b31db6e2a9b3,5,"Pertemuan dengan talent ini adalah pengalaman yang luar biasa. Kecerdasan dan eksperimennya membuatnya unik, dan saya merasa sangat terinspirasi setiap kali berdiskusi dengannya."
6d54c04e-82e9-4584-bc1d-af68b99d2df0,e2c2e2f6-01ff-4707-8a48-8c5bbdcced95,4,"Talent ini tidak hanya membuat desain yang luar biasa, tetapi juga bisa bekerja secara mandiri dengan sangat baik. Kreativitasnya luar biasa!"
ba01ce05-a24e-4fc6-8c53-21b1faa624a9,f2427a83-eb72-47dd-aeaf-cf131b5cefa2,5,"Inilah talent yang membuat perjalanan petualangan lebih seru! Suka buku, bersepeda, dan berkuliner membuat setiap momen bersamanya sangat menyenangkan."
5892066b-bda7-44b3-b5a6-67251039ade5,ce0b1701-fc01-41b5-a337-f67498111b42,3,"Meskipun talent ini memiliki kemampuan sutradara yang baik, mungkin ada beberapa ruang untuk peningkatan dalam hal narasi. Tetapi secara keseluruhan, saya menikmati karya-karyanya."
41fd43a7-5c46-4b26-b4c7-339426358de9,c6b7d0a4-2857-4ccc-9d13-4b7ed760bc10,5,"Seorang pengusaha yang visioner dan berjiwa petualang! Setiap kali saya berkolaborasi dengan talent ini, saya merasa diilhami untuk mencapai lebih banyak hal."
9c1ff9f6-70d9-43d6-8e82-7cbcc6bcd34f,082e524f-4bb3-4115-b047-3b77e03f2f8a,4,Saya sangat terkesan dengan kemampuan talent ini dalam mengedit film. Setiap adegan terlihat begitu mulus dan mengalir dengan baik.
1c8995f0-ec41-4b00-93ba-9969dc49a94c,df498b09-a284-4cd3-8ef6-3a3d0b3cadfd,3,"Talent ini memiliki kemampuan kritis yang luar biasa dalam bidang seni. Namun, saya berharap dia bisa lebih terbuka terhadap ide-ide baru dalam proyeknya."
3cd16141-0721-4adf-ad57-42e0f66b79ca,f27b2958-48de-4f11-a94c-d2b39ea3433b,5,Saya suka dengan kemampuan coding dan penggunaan teknologi dari talent ini. Setiap proyek yang dia kelola selalu menghadirkan solusi inovatif.
161e84d9-11dd-4362-9990-da7d0451a805,06ad747d-b1e1-42d1-aa1b-407b4fde8e81,4,"Talent ini bukan hanya seorang coder yang hebat tetapi juga memiliki kecerdasan humor yang luar biasa. Setiap kali bersama, saya selalu tertawa dan belajar banyak."
ad1b0165-0563-447c-9c65-c04aa1fa2192,8567b129-dcc8-47f0-be27-3584d77dea1d,3,"Saya menghargai kreativitas talent ini dalam dunia fashion dan musik. Namun, mungkin ada beberapa aspek teknis yang perlu diperbaiki."
a2c6519d-5038-4598-a28e-addd57490568,f31e4b38-d953-4088-9bd2-6c6a7892e13f,5,Pengalaman browsing dan eksplorasi bersama talent ini selalu menyenangkan. Saya suka bagaimana dia membawa ide-ide teknologi ke dalam proyek kami.
00034e94-5e54-458f-87d7-b9d9f509c75b,f319979e-579a-47e9-815d-8e453fac749c,4,"Talent ini tidak hanya coder yang baik, tetapi juga sangat humoris. Setiap kali bekerja dengannya, suasana selalu ceria dan produktif."
2af2461d-ec53-4fad-ab6b-f7865eaf5f3f,9340dc4b-26ec-4911-bc2a-57100b0c8c9d,3,"Meskipun talent ini memiliki suara yang luar biasa, mungkin ada sedikit ketidakcocokan dengan minat saya yang lebih condong ke sastra dan buku."
b347d0e5-4c4a-48c5-b673-a00766a1ee38,fd1b1b7a-8995-43b1-a8e0-b28e9343e0d3,5,Berpelukan dengan talent ini adalah seperti memasuki dunia seni yang indah. Kreativitas dan imajinasinya sungguh luar biasa.
3bfb576f-db27-4ae7-9a4e-4abbba6d05a4,dec0a794-803c-4a77-ab00-fece93c2d94a,4,Sangat terkesan dengan inovasi dan keahlian teknis talent ini dalam mengajar. Setiap sesi bersamanya adalah kesempatan untuk belajar hal-hal baru.
00836371-e5cc-4fe7-950f-dbd00cae133d,d1c2e8c3-abfd-4c46-a4ad-8929bc8133e7,3,"Talent ini memiliki semangat petualangan yang besar. Namun, mungkin perlu sedikit peningkatan dalam aspek bisnis dan keuangan."
d75341a3-2e28-416f-a0b4-5fa721975f0d,7a4b91ad-968c-4dce-bdd0-d8d3b02ada8a,4,"Talent ini sangat ahli dalam dunia sastra dan kreatifitas. Saya sangat menikmati waktu saya dengan dia, dan saya memberikannya rating 4 karena ada beberapa hal yang bisa ditingkatkan."
9f9f6fd4-8503-4897-80bd-1fbdd020874a,18857854-05cb-4c9a-9464-4f376e261c52,5,"Sangat menyenangkan bekerja dengan talent ini. Kreativitasnya luar biasa, dan hasil videonya benar-benar memukau. Memberikan rating 5 tanpa ragu!"
fdbdcfc0-d8ba-4f2e-b1d8-8ff8e99a7b5b,971a931c-4873-4e5b-b1a2-81a4a39b317b,3,"Meskipun talent ini memiliki keahlian mengajar yang baik, saya merasa ada beberapa hal yang kurang dalam eksperimen yang dia lakukan. Memberikan rating 3 sebagai bentuk konstruktif untuk perbaikan."
144db220-4f63-4e55-90c7-882071b2ef4e,4809b462-0c50-427b-ad76-0642a6e619af,5,Talent ini benar-benar luar biasa! Keahlian dalam traveling dan kuliner membuat setiap momen bersamanya menjadi tak terlupakan. Memberikan rating 5 dengan senang hati.
cb147c46-4b5f-4208-bb37-024d94ab889b,85b5f43e-0e28-468a-bbdc-515d99c09a66,4,Bekerja sama dengan talent ini sangat menyenangkan. Fleksibilitas dan kreativitasnya membuat proyek ini menjadi sukses. Memberikan rating 4 sebagai apresiasi untuk kerja kerasnya.
e618f249-550a-4a0c-9a35-97a61d7815d1,c6d962f7-0181-4214-9d04-e712fe488330,5,Talent ini adalah keseimbangan sempurna antara bisnis dan seni. Saya sangat terkesan dengan keahliannya dalam seni dan berbisnis sekaligus. Memberikan rating 5 tanpa ragu!
4e7af2df-bd8c-4008-ad68-e0c384de772a,53421c7b-5c31-4518-baa6-afd07473c8fb,3,"Pembuat perhiasan ini memiliki keahlian yang luar biasa, tetapi saya berharap dia dapat lebih bersabar dalam proses pekerjaannya. Memberikan rating 3 sebagai saran konstruktif."
7a922185-a6f6-4291-ab0f-e1f9ddfbf52f,b65b0a58-bdf2-4738-9f2d-6efdbe262da8,4,Talent ini adalah programmer yang sangat inovatif. Kreativitasnya dalam coding dan desain sangat mengesankan. Memberikan rating 4 untuk pekerjaan hebatnya.
98a1c454-2649-4094-abae-a1d1be85b359,366dfd5c-24fb-41dc-a02f-b9aac74b5068,5,Penulis ini memiliki kemampuan storytelling yang luar biasa. Saya sangat menikmati setiap karyanya. Memberikan rating 5 sebagai penghargaan untuk bakatnya yang mengagumkan.
30e59062-be5b-4c4c-878d-1181ef843f07,1815b57c-67c4-4a16-b3be-647862ad6b35,2,"Sayangnya, pengalaman saya dengan talent ini kurang memuaskan. Terdapat beberapa ketidaksesuaian dalam pekerjaannya yang membuat saya memberikan rating 2."
1de59b1c-e85d-48e6-829a-9cd765c4055b,9ad2441a-4900-4cdc-96e9-615ecc8365c8,4,"Talent ini memiliki keterampilan musik yang luar biasa. Kolaborasi kami sangat sukses, dan saya memberikan rating 4 untuk bakat musiknya yang memukau."
ef9a5aa5-aedc-4b38-93f2-3a164a286ed9,92c9844f-7539-4fbb-9244-14e55cd5c137,5,Sangat senang berkolaborasi dengan talent ini. Pemahaman yang mendalam tentang sastra dan keberanian dalam eksperimen membuatnya luar biasa. Memberikan rating 5 dengan senang hati.
bc371553-d246-4f83-8b50-41bfc0726722,7ff10a48-0f1a-40af-93c8-6960d345309a,3,"Walaupun talent ini memiliki kreativitas yang tinggi dalam desain, saya berharap dia dapat lebih inovatif. Memberikan rating 3 sebagai saran untuk peningkatan."
73c19d63-c9b1-4183-9fad-f3d0ae19fa3e,6e7cf4de-e55b-4fd6-b86c-9c4b0891bfc3,5,Pelukis ini memiliki keahlian yang luar biasa dalam menciptakan karya seni yang memukau. Setiap detailnya dipertimbangkan dengan baik. Memberikan rating 5 tanpa ragu!
