user_id,talent_id,rating,review
57552d83-da58-4f10-850f-04808e226343,c65435f7-9155-4911-9c0f-8029a7a502f5,3,Kurang sesuai dengan preferensi saya. Mungkin lebih cocok untuk orang lain. Tetap berusaha ya!
ad83710f-6f83-4f88-a49d-f91f833e2595,6426411f-a89a-4514-9c4f-62dd3bc63c08,5,Keren banget talentnya! Independen dan sangat perfeksionis. Suka dengan hasilnya.
b31b09bd-b24c-4eca-9b5a-1dc285696358,66300a1a-d95e-45c3-b09f-4cbd05f72f65,4,Seniman multitalenta. Kreatif dan memiliki keahlian dalam berbagai bidang. Saya suka dengan kontribusinya.
984e165b-0b2b-4ae4-b343-b8c6fab6ca62,51acb038-3838-4bfe-a8ef-96af203b859d,5,Berpengalaman dan sangat inovatif dalam bidangnya. Rekomendasi tinggi!
3dc6a29c-7d5c-4156-8fde-14cae1803985,a448e568-1d77-4ebd-a7e3-dac2003e32c2,3,Tidak sepenuhnya sesuai ekspektasi saya. Tetapi masih layak dicoba untuk orang yang mencari sesuatu yang berbeda.
f833b8ee-d384-4a1b-898a-1eb607c364c5,bd5d45ec-717f-459e-a1ae-2d82bbb8e3b0,4,Talent yang ambisius dan kritis. Penuh dedikasi terhadap pekerjaannya. Sangat direkomendasikan.
254028f3-d470-4f52-984d-3db0926123ae,5806eb15-0473-44da-b626-d475a8632750,4,"Sangat ramah dan mudah berkomunikasi. Memberikan suasana yang nyaman. Sedikit ruang untuk perbaikan, tapi tetap baik."
ad83710f-6f83-4f88-a49d-f91f833e2595,9a49b79e-441a-4c98-9f13-ed718e682611,3,Mungkin kurang cocok dengan minat saya. Tetapi talentnya sangat berpengetahuan dan analitis.
16741765-3f93-471c-a47e-c6a2a928391d,bed45543-0790-484a-b676-f1359d17c9bc,5,"Sangat terkesan dengan talent ini. Kreatif, terorganisir, dan memiliki visi yang kuat. Layak mendapatkan rating tinggi."
b31b09bd-b24c-4eca-9b5a-1dc285696358,2ec41425-8d23-40bf-9a6b-ef278d90c083,4,Senang berkolaborasi dengan talent ini. Kreatif dan memiliki keahlian dalam berbagai bidang multimedia.
e5f36fa9-1e8c-49f8-8578-9fac3f3f19f9,799e7565-cf9d-41f6-8a6c-539fa2f7690e,3,Saya rasa masih ada ruang untuk peningkatan dalam keterampilan talent ini. Tetapi kerja kerasnya patut diapresiasi.
9dd2765b-4760-41c7-95d9-1906a8e22c13,b0eaad2b-4a67-46b7-959d-acf130e02741,5,Talent yang sangat inovatif dalam bidang teknologi dan desain. Kolaborasi yang menyenangkan!
6da22d8a-16cd-4c51-8381-9cffd8f7a8d8,bed45543-0790-484a-b676-f1359d17c9bc,4,Pengalaman yang menyenangkan bekerja dengan talent ini. Ramah dan terbuka terhadap ide-ide baru.
0f284b53-d6db-4769-a6d6-833bc6748486,5d2c5bf2-6965-4cc6-8732-10afe80d995f,3,Tidak sepenuhnya sesuai dengan ekspektasi saya. Mungkin talent ini lebih cocok dengan proyek yang berbeda.
3dc6a29c-7d5c-4156-8fde-14cae1803985,bd5d45ec-717f-459e-a1ae-2d82bbb8e3b0,5,Sangat puas dengan hasil kerja talent ini. Ambisius dan selalu memberikan yang terbaik.
f833b8ee-d384-4a1b-898a-1eb607c364c5,0bddfd5e-bfc3-4524-af49-4608f32a1c50,4,Kemampuan talent ini sangat mengesankan. Komunikatif dan memiliki pemahaman yang baik terhadap konsep-konsep kompleks.
ad83710f-6f83-4f88-a49d-f91f833e2595,dd46ac25-bb9d-4d4d-81fb-f2001230a876,5,Sangat suka dengan pendekatan talent ini terhadap karya seni. Cerdas dan memiliki pandangan yang unik.
984e165b-0b2b-4ae4-b343-b8c6fab6ca62,51acb038-3838-4bfe-a8ef-96af203b859d,4,Inovatif dan terampil dalam bidangnya. Kekuatan utamanya ada pada kemampuannya berpikir kreatif.
ef3cade6-92c8-4363-82a1-ada6a53c3d74,cbf53ec5-b9cf-4597-b08b-4a2659faff44,4,"Talent ini sangat ahli dalam psikologi, sangat membantu!"
72fd9530-c45a-4440-8a0e-d64c61bc60c3,2ab7d5ea-db1f-498e-ba54-68906fdd5a2d,5,Kpopers yang kreatif! Saya suka bakatnya dalam ilmuwan data.
f4458012-2a4c-437b-bd98-be138e63f7f9,a448e568-1d77-4ebd-a7e3-dac2003e32c2,3,"Seniman dengan kreativitas tinggi, namun mungkin perlu lebih terorganisir."
7cce98af-1ee4-434e-b61f-44928ab11166,77cfd5e7-3a9d-48f2-ad22-b90b3abc12a2,5,Programmer yang sangat inovatif dan membantu!
44fb1765-a309-450f-9b44-2fc067df597c,1f8966d7-f4aa-4a86-95a0-74888cefc6c9,4,"Bisnis dan analitis, talent ini punya cara berpikir yang tajam."
d2d971dc-e158-456f-836e-71172ab9bc2f,e67e4913-c591-4908-82bb-818426396238,2,"Sebagai pengajar, tampaknya kurang cocok dengan minat saya."
0cdb0d21-53b5-4929-871c-8df719d10e51,25a83546-6b39-4319-91b4-4a057dc9f768,4,Seniman olahraga dengan pemahaman yang mendalam tentang seni.
82416469-90bb-4c01-a046-c28ce3c77f42,028b55d3-2c32-4410-a5e0-2c5526732f23,5,Talent sulap yang hebat! Kreatif dan inovatif.
2f052e78-e2be-4f5f-b68f-5e37ee202bed,239e6b47-80bb-41ae-8297-b0d7492ed472,3,"Programmer dengan kreativitas tinggi, namun perlu lebih humoris."
49942c1a-5514-4799-856a-84e8ea730636,7581e40e-b56c-4204-b8c5-0df9f52f352b,4,Psikolog yang ramah dan kesehatan yang sangat baik.
2a202d43-0ada-42a6-abe4-a996cb451da6,7f2f85fb-b6ed-4707-8763-2cc67c398b30,5,Pengajar yang sangat disiplin dan perfeksionis dalam pekerjaannya.
9c1dbde4-f949-4422-8d88-33463a49f090,b8917216-c9cb-4916-8343-de5578cbe6dd,2,Programmer yang kurang optimis dan lebih cocok sebagai pramugari.
bce36145-88c2-4b96-a71d-1259e276e26b,cd355ed9-6f80-414d-b22c-eb036a573c1f,4,"Musisi yang kreatif, bermain game dengan gaya unik."
984e165b-0b2b-4ae4-b343-b8c6fab6ca62,87ab9b72-a368-4f1f-b62e-deb71d03de32,3,Peneliti dengan pemahaman yang mendalam tentang intelektualitas.
e5a13d4f-c624-4bb1-a874-29bb14f31caf,e48453b0-1697-4ff7-ab78-f7712a84e6ec,5,Fashionista yang kreatif dan inovatif dalam gaya.
132538e6-e22e-4fdb-8d48-c8d2fa9ab5db,62dd6719-32e9-4509-8ef4-f9bd03302e4f,4,Pengajar budaya dengan kemampuan lari yang baik!
2c7c675a-9f46-4409-8a83-07c2e785ca16,bca6acfa-18bd-46ee-9896-ffcfd4c9f1d2,2,"Tidak cocok dengan minat saya, talent ini terlalu analitis."
9cee09c4-cb87-438a-b0fa-5e21799ba6f3,49d0b5d1-7c22-41f5-8ad3-6de1e7a34286,4,"Teknologi dan seni, kombinasi yang menarik dari talent ini."
806f4486-7a4d-4e70-9617-2132139266b7,180a1ad1-1770-4fbf-9947-9c2aca84df84,5,Atlet seniman dengan kecakapan joging yang luar biasa.
567ee66c-c665-4858-991d-854e718fc07a,c6ae2bb0-c5e7-4c1f-be87-df1e26d03409,3,"Sutradara yang kreatif namun merokok, mungkin perlu mempertimbangkan kembali kebiasaannya."
d361d6a1-c9e5-498a-a75d-ee629d831962,1d091616-24e0-41c1-929e-c240f0935d7b,4,Pengajar musisi dengan kemampuan prank yang kreatif.
f33f518c-4303-48f7-a5d7-57dbaedee6c5,c5699028-6b9a-4fd7-933c-baa19157c0e9,3,Pengajar inovatif yang kurang disiplin dan terorganisir.
c82fbc91-4135-416e-8e33-758369155276,4e96ef4d-9abc-404d-b4c8-6c47de26c5de,5,Fotografer petualang yang memiliki keberanian yang luar biasa.
70932ea1-56ae-4d61-9c48-eb004c05b47f,6426411f-a89a-4514-9c4f-62dd3bc63c08,4,Peneliti seni yang dermawan dan independen.
e01cbd34-5258-48f5-895e-72d12a2c58c2,1029cc30-abd4-424c-8412-99b0c5b27229,5,"Berenang dan teknologi, talent yang unik dengan kombinasi menarik."
31c07856-9bb8-40ea-b842-464b9af06789,4bfa2cde-c4c2-4448-a8ab-56271f15b886,3,Pengajar yang mahir dalam menjahit dan budaya.
973fbb5b-4bbf-4093-953d-54ce3a5a9ed9,4ea4adc0-b279-496d-ace1-b6035a7d80d6,4,Programmer yang ramah dan humoris.
90185885-d7b6-42f7-9371-ca29dfdd835e,67425414-f1e8-4297-b1e3-5940c7340e36,5,Olahragawan fashion yang ambisius dan disiplin.
aa10fbb9-15b6-4eed-9429-025cb5fd0620,ce9c6c39-ab1f-473f-8078-c95d29312061,3,Programmer inovatif yang bekerja fleksibel.
8df41b70-b7d0-4a6a-aa99-5118793fabb3,e302d256-86ec-4e83-ac76-089c149ee7cd,4,"Teknologi dan bisnis, talent yang independen dan kreatif."
09de9e8d-a0e7-4882-8dc4-2bbdf8566140,b8917216-c9cb-4916-8343-de5578cbe6dd,2,Programmer yang tidak optimis dan tidak cocok sebagai pramugari.
23cccf9d-ae99-4b62-a6c6-f3ca522e5fb2,16afa7be-2b8d-458a-bcfa-c65e77997892,4,"Patriotik yang pandai meditasi, kombinasi yang menarik."
38cc0df3-ba55-439b-b3ae-e89030059df2,d92bdb5b-2540-4013-b423-b3f8c24449ef,5,Fotografer yang berani dan suka petualangan.
058b62c3-bc85-4624-ae92-a4c660ed107f,6426411f-a89a-4514-9c4f-62dd3bc63c08,3,"Seni dan multimedia, talent yang kreatif dan unik."
1ff7ad44-ad4e-4d17-9a65-8b5f68564e54,1029cc30-abd4-424c-8412-99b0c5b27229,4,"Berenang dan coding, kombinasi yang menarik."
2a0e6527-1af3-4e17-be90-168de9ce847f,d37e22fe-70a5-4bfe-9276-4435e8f56806,5,Seniman cosplay dengan manajemen yang baik.
8928f9e6-a524-4e57-a8b2-a91b2c6c0d27,1f17bf3f-dc60-4584-97d0-5f66d3c127e0,4,Fashionista dermawan dan perfeksionis.
c4f9c562-6ea3-4364-aced-88b368ba87be,8d68a99c-7644-4d2e-9c0b-9054ae202c38,3,Programmer inovatif yang ambisius dan kreatif.
dabce9a8-e2b5-457c-a8e2-385d4f4c8c0e,167c23a2-5f3d-48f1-87a5-e7e8b4ce8e44,4,"Musisi yang juga seorang psikolog, sangat kreatif dan ramah."
4d1d79cd-89bb-47d2-8cbc-bd960979c9f7,66300a1a-d95e-45c3-b09f-4cbd05f72f65,5,Seniman multimedia yang mahir dalam memasak.
950910bd-0256-44e7-b6f8-33e8d19f90d6,e557270c-fe36-455f-b9a7-ba5b478b8254,4,Animator berjiwa sosial dengan kreativitas tinggi.
29d4ebf9-3255-4d40-81fd-f69d45eddc1c,952cb4e1-fb04-47ea-ac27-f02c7dada141,5,Sutradara dan penulis film yang sangat ambisius dan kreatif.
1c87bdec-d534-4b4e-8c6b-5aa5ac5ca34c,1029cc30-abd4-424c-8412-99b0c5b27229,3,"Berenang dan coding, kombinasi yang menarik."
ef3cade6-92c8-4363-82a1-ada6a53c3d74,cbf53ec5-b9cf-4597-b08b-4a2659faff44,4,"Talent ini memberikan wawasan psikologis yang mendalam, sangat direkomendasikan!"
72fd9530-c45a-4440-8a0e-d64c61bc60c3,2ab7d5ea-db1f-498e-ba54-68906fdd5a2d,5,Penasaran dengan Kpopers yang kreatif? Talent ini luar biasa dalam ilmuwan data.
f4458012-2a4c-437b-bd98-be138e63f7f9,a448e568-1d77-4ebd-a7e3-dac2003e32c2,3,"Seniman dengan kreativitas tinggi, namun masih perlu beberapa peningkatan terkait keteraturan."
7cce98af-1ee4-434e-b61f-44928ab11166,77cfd5e7-3a9d-48f2-ad22-b90b3abc12a2,5,Sangat senang bekerja dengan programmer yang inovatif ini. Penuh solusi!
44fb1765-a309-450f-9b44-2fc067df597c,1f8966d7-f4aa-4a86-95a0-74888cefc6c9,4,Pendekatan bisnis dan analitis talent ini sangat membantu dalam menghadapi masalah.
d2d971dc-e158-456f-836e-71172ab9bc2f,e67e4913-c591-4908-82bb-818426396238,2,Kelas pengajar ini mungkin kurang sesuai dengan minat saya.
0cdb0d21-53b5-4929-871c-8df719d10e51,25a83546-6b39-4319-91b4-4a057dc9f768,4,Kombinasi antara seniman dan olahraga memberikan pandangan yang unik tentang seni.
82416469-90bb-4c01-a046-c28ce3c77f42,028b55d3-2c32-4410-a5e0-2c5526732f23,5,Saya terpesona dengan keahlian sulap dari talent ini. Sangat kreatif dan inovatif.
2f052e78-e2be-4f5f-b68f-5e37ee202bed,239e6b47-80bb-41ae-8297-b0d7492ed472,3,"Programmer yang kreatif, tetapi mungkin perlu menambahkan sedikit elemen humor."
49942c1a-5514-4799-856a-84e8ea730636,7581e40e-b56c-4204-b8c5-0df9f52f352b,4,Psikolog yang ramah dan berpengetahuan dalam kesehatan. Rekomendasi!
2a202d43-0ada-42a6-abe4-a996cb451da6,7f2f85fb-b6ed-4707-8763-2cc67c398b30,5,Pengajar ini sangat disiplin dan perfeksionis dalam memberikan pelajaran. Luar biasa!
9c1dbde4-f949-4422-8d88-33463a49f090,b8917216-c9cb-4916-8343-de5578cbe6dd,2,"Programmer yang kurang optimis, namun pengetahuan pramugari mungkin tidak sesuai."
bce36145-88c2-4b96-a71d-1259e276e26b,cd355ed9-6f80-414d-b22c-eb036a573c1f,4,Musisi yang kreatif dan unik dalam bermain game. Sangat menarik!
984e165b-0b2b-4ae4-b343-b8c6fab6ca62,87ab9b72-a368-4f1f-b62e-deb71d03de32,3,Peneliti dengan pengetahuan yang mendalam tentang intelektualitas. Mungkin butuh sedikit lebih ramah.
e5a13d4f-c624-4bb1-a874-29bb14f31caf,e48453b0-1697-4ff7-ab78-f7712a84e6ec,5,Fashionista yang kreatif dan inovatif dalam merancang gaya. Suka!
132538e6-e22e-4fdb-8d48-c8d2fa9ab5db,62dd6719-32e9-4509-8ef4-f9bd03302e4f,4,Pengajar budaya dengan kemampuan lari yang luar biasa. Sukses terus!
9cee09c4-cb87-438a-b0fa-5e21799ba6f3,49d0b5d1-7c22-41f5-8ad3-6de1e7a34286,4,Teknologi dan seni yang dihadirkan oleh talent ini sangat menarik.
806f4486-7a4d-4e70-9617-2132139266b7,180a1ad1-1770-4fbf-9947-9c2aca84df84,5,Atlet seniman dengan kecakapan jogging yang luar biasa. Sangat menginspirasi!
567ee66c-c665-4858-991d-854e718fc07a,c6ae2bb0-c5e7-4c1f-be87-df1e26d03409,3,"Sutradara yang kreatif, namun mungkin perlu mempertimbangkan kembali kebiasaannya."
d361d6a1-c9e5-498a-a75d-ee629d831962,1d091616-24e0-41c1-929e-c240f0935d7b,4,Pengajar musisi dengan kemampuan prank yang kreatif. Suka!
f33f518c-4303-48f7-a5d7-57dbaedee6c5,c5699028-6b9a-4fd7-933c-baa19157c0e9,3,"Pengajar inovatif, tetapi mungkin perlu lebih terorganisir."
c82fbc91-4135-416e-8e33-758369155276,4e96ef4d-9abc-404d-b4c8-6c47de26c5de,5,Fotografer petualang yang berani dan suka petualangan. Fotonya luar biasa!
70932ea1-56ae-4d61-9c48-eb004c05b47f,6426411f-a89a-4514-9c4f-62dd3bc63c08,4,Peneliti seni yang dermawan dan independen. Sangat berharga!
e01cbd34-5258-48f5-895e-72d12a2c58c2,1029cc30-abd4-424c-8412-99b0c5b27229,5,"Berenang dan teknologi, kombinasi yang menarik dari talent ini. Sangat sukses!"
31c07856-9bb8-40ea-b842-464b9af06789,4bfa2cde-c4c2-4448-a8ab-56271f15b886,3,Pengajar yang mahir dalam menjahit dan budaya. Perlu sedikit peningkatan terkait disiplin.
973fbb5b-4bbf-4093-953d-54ce3a5a9ed9,4ea4adc0-b279-496d-ace1-b6035a7d80d6,4,Programmer yang ramah dan humoris. Pembawaan yang menyenangkan!
90185885-d7b6-42f7-9371-ca29dfdd835e,67425414-f1e8-4297-b1e3-5940c7340e36,5,Olahragawan fashion yang ambisius dan disiplin. Sangat menginspirasi!
aa10fbb9-15b6-4eed-9429-025cb5fd0620,ce9c6c39-ab1f-473f-8078-c95d29312061,3,"Programmer inovatif yang bekerja fleksibel. Namun, perhatikan batas kerja."
8df41b70-b7d0-4a6a-aa99-5118793fabb3,e302d256-86ec-4e83-ac76-089c149ee7cd,4,"Teknologi dan bisnis, talent yang independen dan kreatif. Rekomendasi!"
38cc0df3-ba55-439b-b3ae-e89030059df2,d92bdb5b-2540-4013-b423-b3f8c24449ef,5,Fotografer yang berani dan suka petualangan. Membawa pengalaman baru dalam setiap foto.
1ff7ad44-ad4e-4d17-9a65-8b5f68564e54,1029cc30-abd4-424c-8412-99b0c5b27229,4,"Berenang dan coding, kombinasi yang menarik. Sangat sukses!"
2a0e6527-1af3-4e17-be90-168de9ce847f,d37e22fe-70a5-4bfe-9276-4435e8f56806,5,Seniman cosplay dengan manajemen yang baik. Kreatif dan detail.
8928f9e6-a524-4e57-a8b2-a91b2c6c0d27,1f17bf3f-dc60-4584-97d0-5f66d3c127e0,4,Fashionista dermawan dan perfeksionis. Desainnya luar biasa!
c4f9c562-6ea3-4364-aced-88b368ba87be,8d68a99c-7644-4d2e-9c0b-9054ae202c38,3,Programmer inovatif yang ambisius dan kreatif. Mungkin perlu lebih rinci dalam rencana kerja.
4d1d79cd-89bb-47d2-8cbc-bd960979c9f7,66300a1a-d95e-45c3-b09f-4cbd05f72f65,5,Seniman multimedia yang mahir dalam memasak. Pengalaman kuliner yang luar biasa!
950910bd-0256-44e7-b6f8-33e8d19f90d6,e557270c-fe36-455f-b9a7-ba5b478b8254,4,Animator berjiwa sosial dengan kreativitas tinggi. Rekomendasi!
29d4ebf9-3255-4d40-81fd-f69d45eddc1c,952cb4e1-fb04-47ea-ac27-f02c7dada141,5,Sutradara dan penulis film yang sangat ambisius dan kreatif. Filmnya luar biasa!
1c87bdec-d534-4b4e-8c6b-5aa5ac5ca34c,1029cc30-abd4-424c-8412-99b0c5b27229,3,"Berenang dan coding, kombinasi yang menarik. Namun, perhatikan batas waktu proyek."
2f052e78-e2be-4f5f-b68f-5e37ee202bed,38cb1d0f-8a15-4278-a0f3-0f56e769f4e0,4,Talent ini sangat inovatif dan visioner. Sangat cocok bagi mereka yang suka dengan teknologi dan jurnalistik!
46a61792-7d89-48a5-bd02-59bc6bb41fdc,e44b9360-4605-4df2-b8e7-38779a99dce0,5,Dokter yang ramah dan sangat berpengetahuan. Sangat direkomendasikan untuk konsultasi kesehatan.
5753768d-4430-4956-b58c-69c26c7abbbd,0a838c8e-09df-4855-93b2-639de08f8d6c,3,Talent ini cukup terorganisir dan suka traveling. Sesi Futsal bersamanya selalu menyenangkan.
7ddefd41-8f57-4a4e-81ed-18527977a2b3,2a4b5b55-fabb-4dcc-9588-f1dab07e9225,4,Konsultannya pintar dan punya sense of humor. Layanan yang ramah membuat pengalaman menyenangkan.
8e40c680-809f-425f-8424-d12e5ef80fcb,469ca29b-d98e-4004-a265-849563cfd695,5,Pendaki handal! Pengalaman petualangannya luar biasa. Sangat recomended untuk teman-teman yang suka jogging dan traveling.
29e7cc60-2339-4a88-8ea7-73f16cc0f1ff,4bfa2cde-c4c2-4448-a8ab-56271f15b886,4,Seorang pengajar yang disiplin dan kritis. Selalu memberikan pembelajaran yang menarik dan informatif.
7970e3c1-7571-4b10-8b5e-b37c37abded3,1ce4e249-4955-4439-ab0d-4f3ff02d5b89,5,Talent ini suka olahraga dan game. Menghibur dan punya keahlian dalam bermain musik!
a79ee014-370f-48f6-afa3-708d2df38b3b,23bb553c-997c-4489-ba49-25345267f309,3,"Sesi konsultasinya sangat membantu. Namun, mungkin bisa lebih memperhatikan detail kecil."
41d4f9c4-5689-4a03-b489-1fd31ccc9b63,1ea16794-4504-4676-a74e-a5cccc60c4ab,4,Seorang sutradara kreatif dan inovatif. Kolaborasi yang menyenangkan dalam proyek desain kami.
44c13402-2d2e-418c-b4c7-267b3b6d934e,1b34b365-c0bc-48d9-a66f-042ba1cf090d,5,Fotografer yang luar biasa! Setiap perjalanan bersamanya selalu diabadikan dengan sempurna.
528fb11c-f7b6-4d1f-be72-0121c24e5bff,8f0da535-eb0d-4f05-825f-69a62420f698,4,Programmernya sangat perfeksionis dan kreatif. Kolaborasi project berjalan lancar dan sukses!
49744f61-31a7-4d98-8bb6-3a75bb89317c,434653d7-0a45-4e88-99fc-ad06249b201f,5,Programmer andal dengan keahlian coding yang tinggi. Selalu memberikan solusi inovatif.
3125d35e-3bfe-48f7-bc4b-96c10f04149d,698b597a-e83b-4483-b2ea-5f115bcc3dd4,3,Pengajar yang ramah dan sabar. Pembelajaran berjalan baik meskipun ada beberapa kendala teknis.
e3901b70-c891-432a-945e-41580f5ee319,65c3d834-1cd5-4efa-b735-e49f25c2a7dd,4,Programmer dengan keahlian coding yang sangat baik. Kerja sama yang menyenangkan dan efisien.
25fe48f2-a312-421d-8751-984b5e4a448f,c5699028-6b9a-4fd7-933c-baa19157c0e9,5,Pengajar inovatif dengan pengetahuan teknologi yang mendalam. Pembelajaran menjadi lebih menarik dan interaktif.
ff5ac9b3-ca9d-42ba-b081-298879fbe62c,6742ab46-c8ca-4acc-99b2-9ba1c5bfccb6,4,Fotografer yang ambisius dan kreatif. Hasil karya selalu memukau dan berkesan.
ab9e857d-dca9-4025-986c-9ef3b12afab0,bc9e4ba8-b3ac-4e68-a052-cc053f1e9f62,5,Teknologinya luar biasa. Coding dengan tingkat inovasi yang tinggi. Sangat puas dengan hasil kerjanya.
4c36f34b-cf07-4e00-82b0-31df12e938d9,d37e22fe-70a5-4bfe-9276-4435e8f56806,4,Seniman yang kritis dan ambisius. Pameran seninya selalu menjadi sorotan di dunia seni lokal.
72c8e7e0-2cf3-4bd3-8f92-bd0321aa2533,57915238-27e5-48a4-84af-ecfd641ac80f,5,Seni desain yang sangat cerdas dan inovatif. Kolaborasi project menjadi lebih berwarna dan menarik.
9f07ced2-e74a-4638-9eaa-9ccd8d6e549a,0b97ee33-d654-41cb-a56d-67227e00e20a,4,Pengajar yang ramah dan disiplin. Pelajaran tentang budaya menjadi lebih menarik dan penuh makna.
61f3abb0-2335-4cd7-89cd-319122e5312a,fb8b5217-0ddd-41b2-9224-57c9d933f1f0,5,"Kreatif, psikolog, dan fotografer. Kolaborasi dalam proyek konservasi menjadi sangat berarti."
bb4445fb-b2b9-4d23-a5fa-024633ff397a,cfffe071-49b8-40de-b365-35189509bc48,4,Penulis kreatif dengan pemahaman mendalam tentang sastra. Selalu memberikan kontribusi yang berharga.
217af9dd-8fd0-4935-bf67-b1ae63c304ff,1f8966d7-f4aa-4a86-95a0-74888cefc6c9,5,Analitis dan bisnis-minded. Kolaborasi dalam manajemen project selalu sukses dan efektif.
4cba62dc-d1a8-424f-b504-a66ee042c2ff,67722a98-7109-4564-adb4-8e9121bc3695,4,Peneliti yang inovatif dan ramah. Proyek penelitian bersamanya selalu berjalan dengan baik.
923ae6eb-2df5-45ef-becf-30553439b372,1ad396cd-4261-4539-b82a-3eced43246e5,5,Komposer dengan kreativitas tinggi. Karyanya dalam konservasi seni sangat menginspirasi.
50d3b015-34e8-48bb-b9b1-c3373c5c2c0f,9c8a4c93-22ed-4739-9609-e033fca2ca3c,4,Intelektual dan konsultan yang cerdas. Konsultasinya selalu memberikan wawasan yang berharga.
c81d87b4-9b77-4038-aa04-c2b5f4faa56c,a40c164a-4218-4262-a693-0b7051b0cf02,5,Teknologi dan game enthusiast. Kolaborasi dalam proyek programming sangat efisien dan sukses.
bca2c0ce-68ed-4394-aa5e-ded3625c6cfe,e44b9360-4605-4df2-b8e7-38779a99dce0,4,Dokter yang ramah dan cerdas. Layanan kesehatannya sangat membantu dan profesional.
4ebb976e-7725-4ac2-a808-380cf9468710,6a55aaf6-4c71-4fba-ab7b-cf79c6bd22b9,5,Animator kreatif dan pekerja keras. Hasil karya animasinya selalu menghibur dan memukau.
c30435db-323c-4d7c-a1e6-a9c8c16ca77c,704aaa27-9e6d-4894-a99f-ae804113a4b0,4,Fotografer yang disiplin dan perfeksionis. Setiap project fotografi menjadi lebih berkualitas.
0b9a6bd7-8d0d-4894-90ce-6bda5db2a0eb,6db4c41e-e232-4598-b08b-6e36729fa98d,5,Pengajar melukis dan seni yang disiplin. Setiap kelas seni bersamanya selalu berlangsung dengan baik.
9019e3ea-c702-47f9-9a3e-fe2a48e51ef9,952cb4e1-fb04-47ea-ac27-f02c7dada141,4,Sutradara dan penulis kreatif. Proyek film bersamanya selalu menjadi karya yang memukau.
c2c8fe11-6bec-4157-8d94-035f27417ffe,63c79d40-29f1-48cb-bdd4-3a311fe5f310,5,Desainer yang kreatif dan inovatif. Setiap desain yang dihasilkan selalu sesuai dengan keinginan.
89581954-fd0b-4e07-9307-b0c254c9c179,29d2c692-8e4e-4332-8d68-ec736759dd88,4,Dokter yang ramah dan kreatif. Konsultasi kesehatannya selalu memberikan solusi yang efektif.
113c3854-b714-4345-8038-d34919b32fa7,180a1ad1-1770-4fbf-9947-9c2aca84df84,5,Binaraga dan olahragawan yang cerdas. Pelatihan bersamanya selalu efektif dan memuaskan.
3bd13fef-d201-478b-a907-94c195a961ea,d7f32756-0a15-4280-9936-9f84069deeb3,4,Programmer yang riang dan suka bekerja keras. Hasil codingnya selalu memuaskan.
808e2587-32d0-4073-9c22-6520c6245f28,a0b105e5-ece8-434e-8b92-3eb9ea09e83a,5,Animator yang kreatif dan ahli dalam memasak. Proyek animasinya selalu menjadi daya tarik utama.
b6188272-1405-47f6-9837-0a366b03c852,2bf3ca5f-d8e8-454c-be44-1d74af8a9909,4,Penulis cerdas dan kreatif. Setiap karyanya selalu memberikan pesan yang mendalam.
a3f4e472-ccc8-445b-912c-b2081a11a345,a6cf12e1-a125-4b00-bf43-cb87cd934152,5,Pengajar yang sabar dan optimis. Setiap pembelajaran menjadi pengalaman yang berharga.
8928f9e6-a524-4e57-a8b2-a91b2c6c0d27,b7e3b220-2c95-4400-9dd0-6eb73590f254,4,Programmer inovatif dan suka traveling. Hasil codingnya selalu memuaskan dan efisien.
e09f4222-7adb-42b6-a005-75c83a21c2a5,799e7565-cf9d-41f6-8a6c-539fa2f7690e,5,Kurator seni yang kritis dan ambisius. Pameran seninya selalu menjadi sorotan di dunia seni lokal.
642bb0e3-ff15-47f3-a715-62a8844efed0,af738bff-52f3-4358-b553-fc550953725c,4,Fashion dan seni yang sangat kreatif. Desainnya selalu mengikuti tren terkini.
1d62c6e1-e43a-4bdf-933d-7985fd0b4780,17f9b113-5f94-4b7d-98c6-d8522860dcdd,5,Analitis dan bisnis-minded. Kolaborasi dalam manajemen project selalu sukses dan efektif.
1388d429-fa03-4916-b1e0-ab1c350caf8f,19e583a1-1422-4c00-8bea-a628fdfcc245,4,Musisi dengan suara yang indah dan kreatif. Setiap penampilannya selalu menghibur dan menginspirasi.
b77aa9a6-de66-4940-9c54-7025295136c4,fa9afd16-3d8d-4c25-a2a1-d7b86758a35a,5,Pengajar bisnis dan manajemen yang disiplin. Pembelajaran tentang manajemen menjadi lebih mudah dipahami.
c26116f0-64a1-4ca2-99c5-35abcfafc060,fe74e622-43c9-4715-825a-034199bd48af,4,Penulis yang kreatif dan disiplin. Karyanya selalu memberikan inspirasi dan hiburan.
0f284b53-d6db-4769-a6d6-833bc6748486,c5699028-6b9a-4fd7-933c-baa19157c0e9,5,Pengajar inovatif dengan pengetahuan teknologi yang mendalam. Pembelajaran menjadi lebih menarik dan interaktif.
fa736b4e-eeae-4fcd-8b9a-63a10a26d40b,6742ab46-c8ca-4acc-99b2-9ba1c5bfccb6,4,Fotografer yang ambisius dan kreatif. Hasil karya selalu memukau dan berkesan.
0ac37482-aa48-4913-a289-e41795aa8634,ab59d7c4-a279-4042-b3f6-ac0e412136b3,5,Programmernya sangat perfeksionis dan kreatif. Kolaborasi project berjalan lancar dan sukses!
08b37fce-1aac-490c-8889-f225d1bea163,9d157ac4-3d45-4fd4-bc7a-c6843a17a7d2,4,Talent ini sangat ahli dalam pemrograman dan teknologi. Sangat membantu dalam menyelesaikan proyek saya.
08b37fce-1aac-490c-8889-f225d1bea163,0c9d4ade-c343-4697-a4c0-765fc4e5cf87,5,Kreativitasnya luar biasa! Hasil fotografi yang dihasilkan sangat memukau. Sangat direkomendasikan.
d0baa954-ed5c-4f79-99ac-c914bd2ed656,f5fa3538-8b4a-406e-8ad0-a466ba10ec9b,3,"Makanan yang dimasaknya enak, namun perlu sedikit peningkatan pada aspek kritisnya."
d0baa954-ed5c-4f79-99ac-c914bd2ed656,b5f7d6b6-658b-49fa-a538-ddd10f9a97b5,5,Sangat ramah dan ambisius. Saya senang bekerja sama dengannya dalam proyek basket kami.
532444d6-53d1-4f4f-974d-a749e8e15bfa,261269c4-a020-4b08-89f2-22f08d5167fa,4,Pengajar yang sangat sabar dan cerdas. Pengetahuannya dalam astronomi sangat mengesankan.
532444d6-53d1-4f4f-974d-a749e8e15bfa,12e01139-b3c0-45ce-9294-0874665886c6,5,Penuh disiplin dan memiliki kecerdasan yang tinggi. Sangat cocok sebagai pengajar.
a1ab81e5-7866-4162-ac5d-abbd76f9d8fe,9a49b79e-441a-4c98-9f13-ed718e682611,3,"Keterampilan pemrogramannya baik, namun perlu sedikit lebih kreatif dalam pendekatannya."
a1ab81e5-7866-4162-ac5d-abbd76f9d8fe,e0d3c521-289a-41c2-8487-cab03cc54f31,4,Kritis dan memiliki selera humor yang baik. Kolaborasi dalam proyek fotografi berjalan dengan lancar.
58d058bb-ceb6-4c18-8cab-43a64325a07a,ea7201c8-b969-4f51-9faa-3f8e861c8356,5,Psikolog yang hebat! Membantu saya mengatasi berbagai masalah mental. Sangat direkomendasikan.
58d058bb-ceb6-4c18-8cab-43a64325a07a,72cce559-a16d-49b7-aa69-a30a52a9dddf,4,Musisi yang berbakat. Penyanyinya sangat menyentuh hati. Saya senang bisa bekerja sama.
433bdaa4-5128-471f-add8-fdd28301774b,19b60d3b-e615-4288-991b-95f5d2ff9221,3,"Dokter yang penuh dedikasi. Namun, terkadang kurang bisa memberikan solusi yang kreatif."
433bdaa4-5128-471f-add8-fdd28301774b,cd23fd35-8b63-494a-a86d-5e3fc768c1ce,4,Motivator yang baik. Banyak memberikan inspirasi dan dorongan positif.
bce36145-88c2-4b96-a71d-1259e276e26b,cd7190cf-fcee-4eaa-a7fd-d96e10dfbb9d,5,Pendekatannya yang kreatif dalam desain sangat saya hargai. Sangat direkomendasikan.
bce36145-88c2-4b96-a71d-1259e276e26b,931a56d1-04c6-4216-ba88-90fff6aad1e0,4,Ahli dalam teknologi dan pemrograman. Kolaborasi yang baik dalam mengembangkan aplikasi.
30155105-32e2-4591-9007-491b8b107b7c,1b18b89b-5434-422d-b2d9-294e4c64657e,5,Peneliti yang sangat konsisten dan ambisius. Selalu memberikan hasil yang memuaskan.
30155105-32e2-4591-9007-491b8b107b7c,cd23fd35-8b63-494a-a86d-5e3fc768c1ce,4,Bisnisman yang visioner. Kolaborasi ini membawa banyak ide baru dan inovasi.
da71e533-2a17-4202-bc45-7253febed5d4,3bfdaff9-5796-49bb-bfe9-014eaeb897c5,3,"Aktingnya perlu sedikit dipoles lagi. Namun, potensi besar ada di sana."
da71e533-2a17-4202-bc45-7253febed5d4,538f8301-6e6c-4820-9eb5-4fb077938ca9,4,Editor dan sutradara yang kreatif. Proses produksi film berjalan lancar berkat kolaborasi ini.
