user_id,talent_id,rating,review
5de6b455-0a80-4047-90e7-8ddee7ee2bb8,6742ab46-c8ca-4acc-99b2-9ba1c5bfccb6,4,"Talent ini sangat kreatif dalam fotografi, hasilnya luar biasa!"
5de6b455-0a80-4047-90e7-8ddee7ee2bb8,d9b90682-f5b4-45f7-b1ed-8b8044c945e1,3,"Kemampuan olahraga talent ini memuaskan, tetapi masih ada sedikit ruang untuk perbaikan."
bc92f639-6659-4732-ad42-cc62b377f811,1b18b89b-5434-422d-b2d9-294e4c64657e,5,"Sangat puas dengan pengalaman kuliner bersama talent ini, rasanya luar biasa!"
9a8427dd-ef41-46d9-86fe-063129e8190e,931c2814-1f84-404f-851a-7fb075835d95,4,"Talent ini memberikan konsultasi bisnis yang sangat berguna, saya sangat merekomendasikannya."
0e9ced1a-35a0-4ad5-a204-3d5c843de78f,ddc39acb-d29b-43f0-abcd-f54fe7be2904,2,Kemampuan gym dan jogging talent ini tidak sesuai harapan saya.
e4710b8e-dcf5-42ca-a17b-6f1ad494ded4,9a49b79e-441a-4c98-9f13-ed718e682611,5,"Talent ini sangat perfeksionis dalam coding, hasilnya sangat memuaskan."
cdcaf9d1-1dd8-4bce-8c50-69d1ea8056f9,cd355ed9-6f80-414d-b22c-eb036a573c1f,4,"Musisi yang kreatif dan inovatif, saya senang bekerja dengannya."
b31b09bd-b24c-4eca-9b5a-1dc285696358,05d1ee73-0475-40c6-89d4-5cb7e5abf18f,3,Saya berharap talent ini bisa lebih ramah dan interaktif dalam fotografi.
2843fbb1-35af-4ded-b375-cc606289e1a7,27f100e4-fca9-4bf8-bb4f-616ef745bc93,5,"Hasil fotografi talent ini sangat memukau, saya sangat senang dengan pengalaman ini."
2e9acb32-1141-417e-b721-68e5925b2b85,fc16bbc1-20ff-4fb5-96e6-9dc0f36d8a6b,2,"Tidak puas dengan hasil karya seni talent ini, kurang sesuai dengan preferensi saya."
8bd5138b-df90-4279-b885-61e3f70c55c9,0790910d-0408-458e-b2f7-d63095f5a934,4,"Komposisi musik dari talent ini sangat bagus, saya suka dengan kreativitasnya."
f658a223-ad0b-437a-a6c3-c940b54fc9f1,a34c01d7-51fe-4856-a6cd-2d97d8dbfbbb,3,"Film yang disutradarai oleh talent ini memiliki plot yang menarik, tetapi eksekusi kurang memuaskan."
9dd2765b-4760-41c7-95d9-1906a8e22c13,0622c7ee-b132-4e79-bcad-3a1a069e398a,5,"Talent ini memiliki pengetahuan olahraga dan musik yang luar biasa, sangat merekomendasikan."
33eecceb-7fb6-497f-abed-f4ec5062bbcd,484ee130-c1ee-4fa3-ace3-f50ca80443b3,4,"Pengalaman fashion bersama talent ini sangat menyenangkan, saya senang dengan pilihan desainnya."
9b0517e7-941f-461c-a8a3-8dc7c95f7897,180a1ad1-1770-4fbf-9947-9c2aca84df84,3,"Talent ini memiliki keterampilan olahraga yang baik, tetapi saya berharap lebih banyak variasi."
2f69eee2-9d6e-49a2-9a1f-e064d0b52f12,cbd6faf9-edbb-453f-baaa-7ad8039d8e21,5,"Coding talent ini sangat inovatif, membantu saya menyelesaikan proyek dengan cepat dan efisien."
c8bcc89b-c9c0-4226-9782-3470b0ecb51f,0be48e47-7f6f-4c35-be74-82446d490878,4,Olahraga dan musik talent ini memberikan semangat dan energi positif pada setiap sesi.
132538e6-e22e-4fdb-8d48-c8d2fa9ab5db,b41d99bc-0952-459c-b2a5-d2f829a643df,3,"Konsultasi bisnis dengan talent ini kurang memuaskan, saya harap bisa lebih spesifik dan praktis."
ccefaf8d-fb7d-4f8a-993a-5dc261fe8513,92b5ccd7-a5a8-4eea-bd5a-827be13cdc1b,5,"Seni talent ini memiliki daya tarik dan kreativitas yang tinggi, saya senang dengan hasilnya."
fa64e8b0-ceb7-4e65-8296-3b386d7ed6f3,92b5ccd7-a5a8-4eea-bd5a-827be13cdc1b,4,"Saya suka dengan pendekatan kreatif talent ini dalam seni, tetapi mungkin bisa lebih terstruktur."
5c6fdd52-1e2e-4170-952d-afd800ab7a20,537405d0-4004-4f46-b7b0-a10857c22a74,3,"Musisi talent ini memiliki gaya yang unik, tetapi tidak sepenuhnya sesuai dengan preferensi saya."
af6f32a4-0372-4378-aadd-4f86727e06c7,18e716ea-264e-4029-bf64-786456417d18,5,"Pengalaman belajar dengan talent ini sangat menyenangkan, dia memiliki pengetahuan yang luas."
2e7fd52d-a98b-440f-8f25-94cfb52c07ab,19b60d3b-e615-4288-991b-95f5d2ff9221,4,"Dokter talent ini memberikan penjelasan yang jelas dan mudah dimengerti, sangat merekomendasikan."
4c14c206-c7f5-40ef-b157-95a60ebe5378,fe74e622-43c9-4715-825a-034199bd48af,3,"Pengalaman browsing dan diskusi dengan talent ini kurang menarik, tidak sesuai dengan ekspektasi saya."
472abcfb-2ab0-4f02-a224-04d6d408a7e0,b8917216-c9cb-4916-8343-de5578cbe6dd,5,"Talent ini memiliki kemampuan coding yang sangat tinggi, membantu saya menyelesaikan proyek dengan sukses."
ccef4126-6343-4c20-a01f-15fda289f67a,0a070f99-23ba-40da-bd74-12f7bf3a0ef4,4,"Pengalaman belajar yoga dengan talent ini sangat baik, dia sangat sabar dan membantu."
3dc6a29c-7d5c-4156-8fde-14cae1803985,c24fd25f-5784-4c9c-9703-b0076c83c110,3,"Olahraga talent ini memberikan pengalaman petualangan yang menyenangkan, tetapi kurang tantangan."
53885cc3-757e-4cde-9069-e1822d8eb3fa,676b2f1c-7181-4b4f-8529-3a5165ec3627,5,"Teknologi dan coding talent ini sangat unggul, saya sangat puas dengan kerjasama kami."
ea207436-c85e-4c42-bff5-a08bbd1363d0,e302d256-86ec-4e83-ac76-089c149ee7cd,4,"Desain talent ini sangat kreatif dan inovatif, memberikan ide-ide segar untuk proyek kami."
b10a136b-ce32-4601-8d89-d4607d059066,dc931d6c-84f2-4686-b905-bb61ecb5f590,3,"Editor talent ini memiliki keterampilan yang baik, tetapi kurang fokus pada detail."
13f79c74-42ce-4d1e-833c-666bb3d20a52,219a0def-9568-4d15-ae9c-02ffce9ac4a7,5,"Olahraga dan musik talent ini memberikan energi positif, sangat merekomendasikan."
64cae157-6c06-4356-b1c3-f74b1f4a3d90,8d29ecb8-b90c-4f60-90db-5d54fc740620,4,"Talent ini memiliki visi yang jelas dalam manajemen proyek, membantu kami mencapai tujuan dengan baik."
f5b01cb5-d06c-41fc-880a-694d9c74e96c,26dfb855-9598-463e-ab05-2669f5cd43ea,3,"Koki talent ini memiliki keterampilan yang baik, tetapi mungkin kurang eksperimen dalam menu."
5e290159-cb49-4529-b25e-7291605d93d5,7fbb699f-bd88-46e9-94fb-6088e5233a30,5,"Desain talent ini sangat kreatif dan artistik, saya sangat puas dengan hasilnya."
4cba62dc-d1a8-424f-b504-a66ee042c2ff,ca3286f5-6be3-4e77-91b3-928710cf8531,4,"Pengalaman belajar geologi dengan talent ini sangat informatif, saya suka dengan pendekatannya."
2293971b-aafd-42fa-b506-f3d18baedddf,af32318e-d85e-48a3-af1b-7f54891fd088,3,"Seni talent ini memiliki kreativitas yang tinggi, tetapi tidak sepenuhnya sesuai dengan preferensi saya."
3ca76a4f-7919-4d37-94b3-c49432bc5c97,9c8a4c93-22ed-4739-9609-e033fca2ca3c,5,"Talent ini memberikan pengalaman yang luar biasa dalam konsultasi cerdas, sangat merekomendasikan."
6ffd1286-5747-4984-91e9-704bf68ea71d,d7d013a3-c4f5-4777-b51e-b4b10739a0d0,4,"Penerjemah talent ini sangat handal, memberikan hasil yang akurat dan tepat waktu."
a91a4075-54b0-41ca-aff1-50cda19da90f,ca0ad2c1-0d38-484b-94d8-c09a2f23d6a5,3,"Talent ini memiliki kemampuan coding yang baik, tetapi kurang berfokus pada aspek desain."
e517b0fd-35ef-4c62-b1f8-c503369f545a,7bdad265-2df2-41ef-8925-79950844e121,5,"Desain talent ini sangat inovatif dan kreatif, memberikan ide-ide segar untuk proyek kami."
6a31b2a6-f149-4afa-84cc-38855dc4b503,3e3aa4f1-4ccf-47f2-be30-3a536944e859,4,"Game talent ini memiliki kemampuan coding yang tinggi, memberikan kontribusi besar pada proyek."
b454b96f-46a5-40d3-b494-e027c3efaabc,953f9d50-5471-4c09-907b-cc4f974836cb,3,"Pengalaman belajar catur dengan talent ini kurang memuaskan, mungkin kurang interaktif."
883c6670-575c-49fe-8613-de73329afd83,bafee4f6-cb52-4636-9617-398f3868ef35,5,"Talent ini memiliki keterampilan kuliner yang luar biasa, saya sangat senang dengan hasilnya."
dc713414-cf95-4a2e-9127-f0a5c91f50c7,541eb68b-c216-4f66-b444-b034683aca1c,4,"Desain interior talent ini sangat visioner dan kreatif, memberikan nuansa yang unik pada proyek kami."
e25e6d06-6327-45c9-b919-4143e84a76b5,16525664-936e-4d2f-881b-4ada79aaaa37,3,"Fotografi talent ini memiliki gaya yang unik, tetapi tidak sepenuhnya sesuai dengan preferensi saya."
6ffd1286-5747-4984-91e9-704bf68ea71d,00627d20-528b-4c4e-92de-d97c12c151d1,5,"Seni talent ini memberikan ide-ide segar dalam desain grafis, sangat merekomendasikan."
c4d335e3-c8db-4bc5-83b1-13856c7178ef,41bd7898-5530-4912-bfde-cce49bf3e76a,4,"Olahraga dan seni talent ini memberikan kombinasi yang unik, sangat suka dengan pengalaman ini."
600687d6-bf67-406d-a50e-768e3d2dd53d,6742ab46-c8ca-4acc-99b2-9ba1c5bfccb6,3,"Fotografer talent ini memiliki kemampuan yang baik, tetapi kurang interaktif selama sesi foto."
6a58a9cc-b016-4ff3-83d4-c41e735bf4df,6742ab46-c8ca-4acc-99b2-9ba1c5bfccb6,5,"Talent ini memiliki keterampilan mendengarkan yang baik, sangat membantu dalam konsultasi."
e2f14ece-ed75-43a7-a57d-ee476a6cdceb,6742ab46-c8ca-4acc-99b2-9ba1c5bfccb6,4,"Pengalaman wisata dengan talent ini sangat menyenangkan, dia sangat ramah dan informatif."
6e1d2cf7-c56b-4b19-8b2b-4c1310a66d35,6742ab46-c8ca-4acc-99b2-9ba1c5bfccb6,3,"Astrografi talent ini memberikan pengalaman yang unik, tetapi kurang variatif dalam tekniknya."
1f29e419-d190-42aa-83d2-5fe5bb7f5e63,c9195b81-3728-4279-8838-e39a55975e34,4,Talent ini sangat kreatif dalam seni lukis dan menggambar. Sangat menyukai hasil karyanya.
89ff8f09-1038-4809-bd3c-2909301f0c1b,ac56a04d-aa98-4591-8e8c-2b188040c114,5,Dokter yang sangat ramah dan sabar. Pelayanan kesehatannya sangat baik.
6be5c375-3921-496a-a317-8c80219a4857,6e5991cc-0291-4c9c-9668-f3b7f0ad4c1f,3,"Cukup baik dalam hal kesehatan, namun ada beberapa hal yang masih perlu diperbaiki."
a900c162-d4e7-440d-8b56-d997f179fddc,37b93456-69d8-426e-b571-ee804648a78d,5,Seorang programmer yang sangat inovatif dan memiliki keahlian coding yang tinggi.
b4530890-bdb8-4018-b24d-614c57ec1a0b,8f0da535-eb0d-4f05-825f-69a62420f698,4,Programmer dengan keahlian animasi yang menarik. Karya-karyanya selalu menghibur.
a9a9c9fe-6683-4c35-b1d6-47ee824cc001,a897d16b-b8ee-472d-ad39-df50aa6ae82f,2,Tidak begitu suka dengan talent ini. Coding-nya kurang baik dan tidak sesuai harapan.
8ac83f8d-9fea-4d6a-9613-1ab0146d9bd7,ec2443c4-c121-4a6d-b960-229b0fced2ac,5,Pengajar yang sangat disiplin dan memiliki keahlian dalam desain grafis. Sangat direkomendasikan.
6a6ed41b-ceb7-4995-a381-9af4c5133798,88d4a5a5-51e1-4d26-b257-86d5fb80d037,4,Fotografer yang memiliki visi yang bagus. Pelayanannya cukup baik.
5ae6c0d3-c476-46cb-899c-81225b21fc50,890c5cfb-eb70-457b-951d-883507428c70,3,"Seni yang ditampilkan kurang memikat, tapi pengajarannya bagus dan disiplin."
27909ddd-c23a-4327-9003-c06bc5e6e566,85ccfc69-4f38-4373-bed3-ec0beecfb5cd,5,Pendaki yang sangat menyukai seni dan olahraga. Pengalaman mendaki bersamanya sangat menyenangkan.
9bed69fa-08cc-45c6-8bf2-232c1f1ced06,3e6dd873-fcd8-41b1-9663-29c15af4d624,4,Kreatif dalam karya seni dan menggambar. Suka dengan cara ia menggabungkan sejarah dalam karyanya.
58d9f4cc-92db-44e3-b1fe-d9b105e5fd1b,93ac984d-cb32-4ded-8863-91b6cd380bca,5,Desainer yang sangat berbakat dan rajin bekerja. Karyanya selalu mengikuti perkembangan zaman.
db7d1700-fd88-4867-8656-48b283e29e0e,3e3aa4f1-4ccf-47f2-be30-3a536944e859,3,"Game developer yang cukup baik. Kreatif, namun perlu lebih meningkatkan kualitas game-nya."
ebd57d18-84a3-49fe-a7bc-2da375ca838f,1d152227-b6c7-4f1a-a878-f3ff5bd1ef4f,4,Pembaca yang sangat patriotik. Menyukai cara ia menampilkan kecintaannya pada tanah air dalam karyanya.
8a4a018e-5590-4190-a109-907babeaa660,2c795930-10f6-4112-a695-ff61e16e915d,5,Fotografer yang memiliki keahlian dalam mengambil momen-momen indah. Sangat direkomendasikan.
30155105-32e2-4591-9007-491b8b107b7c,0fe3196b-75ac-4965-8f3e-4200fb821fa4,2,Penyiar radio yang kurang bisa menghibur. Kurang memiliki kreativitas dalam penyiaran.
0e9ced1a-35a0-4ad5-a204-3d5c843de78f,87ab9b72-a368-4f1f-b62e-deb71d03de32,4,Peneliti yang sangat cerdas dan ambisius. Karya-karyanya selalu memberikan wawasan baru.
0aeac9e7-e638-4da9-a157-637388829b74,f9b937a5-3940-4b81-90ce-f87f2900f405,5,Fotografer dan arsitek yang sangat kreatif. Desainnya unik dan selalu memikat hati.
f40ed3a4-d47a-43d3-bb32-66927f762c18,49d0b5d1-7c22-41f5-8ad3-6de1e7a34286,3,"Talent ini lumayan, tapi kurang memuaskan dalam hal pelayanan."
494a0780-c02a-4f99-a7dc-449460817488,c9195b81-3728-4279-8838-e39a55975e34,5,Seniman yang sangat kreatif dalam melukis dan menggambar. Karyanya selalu memukau.
b867a3f1-a802-4323-a21c-a97fd5f15545,afac4f24-18f2-4fc4-930e-2cb1f439953a,4,Aktor/Aktris dan model yang sangat ambisius. Kreatif dan berbakat dalam dunia film.
a900c162-d4e7-440d-8b56-d997f179fddc,b8917216-c9cb-4916-8343-de5578cbe6dd,3,"Programmer yang cukup baik dalam coding. Inovatif, namun masih perlu beberapa perbaikan."
49035e1b-8837-4c21-a2ca-ac404371b022,c3318550-6af5-42a2-86b3-08498b54c652,4,Pemikir filosofi yang sangat sabar. Memberikan sudut pandang baru dalam berfilsafat.
113c3854-b714-4345-8038-d34919b32fa7,b3c2758a-75ec-4f86-8ce5-d854ab1dcc27,5,Pengusaha yang sangat inovatif dan rajin bekerja. Memberikan inspirasi untuk berbisnis.
4cba62dc-d1a8-424f-b504-a66ee042c2ff,5d2c5bf2-6965-4cc6-8732-10afe80d995f,3,Pengajar yang suka berselancar dan memiliki keahlian dalam budaya. Pelayanannya cukup baik.
d825938b-845a-4040-88b3-188f2e89809e,c5950ec6-b65d-457f-84fe-e5b637a6a940,4,Penyanyi dengan keahlian sastra yang tinggi. Suka dengan cara ia menyajikan lagu-lagu.
8fe1b9d1-e801-4247-a62d-248f96ec3a5f,0bbbab8a-f643-4481-8b8f-80b321552949,5,Konsultan bisnis yang sangat visioner dan rajin bekerja. Memberikan solusi yang tepat.
50d3b015-34e8-48bb-b9b1-c3373c5c2c0f,cb42e0b3-b660-4702-8a7c-636b7f3fe684,3,"Koki yang cukup baik, namun perlu meningkatkan variasi dalam penyajian makanan."
e876d02f-6100-40c1-bd8a-d2f7037e5fd8,16ed6f94-cd3a-48be-9f06-248f25623112,4,Percaya diri dan berbakat dalam bisnis. Kreatif dalam memberikan solusi.
5326baae-7f16-40d1-9215-52476d2cd68c,13132a45-bac1-454f-85d2-300d909ed895,5,Surfer dan arkeolog yang sangat kreatif. Desainnya selalu unik dan menarik.
e5be3b5d-7ebd-4260-899c-c914bd4563b3,f72728c2-0e1f-4a94-a936-d2e155f0bb6d,4,Game developer dan musisi yang memiliki keahlian dalam teknologi. Karyanya sangat menghibur.
2179d017-8775-463c-a2f4-98f7668c2b22,79acdf8c-54cd-48d2-9dd1-52de35b9be29,3,Desainer fashion dan model yang cukup cerdas. Karyanya selalu up to date dengan tren.
f3ac5fa9-feee-42d9-99bf-31d2e825c9e7,723eb914-3915-4884-9fe3-0bae82c50e1a,5,Traveler yang sangat suka mengabadikan momen dengan kamera. Desain UI-nya sangat menarik.
6be5c375-3921-496a-a317-8c80219a4857,27f100e4-fca9-4bf8-bb4f-616ef745bc93,4,"Fotografer yang suka tidur. Meskipun unik, namun memberikan sentuhan artistik."
1c87bdec-d534-4b4e-8c6b-5aa5ac5ca34c,d5b4fb02-5823-4da6-9c82-43eb78e449b5,3,Pengajar dan musisi yang sangat ramah. Pelayanannya cukup baik.
aa10fbb9-15b6-4eed-9429-025cb5fd0620,97efae41-831f-4f05-8214-62cc57a2ae11,4,Stylist yang suka hiking dan rebahan. Sangat kreatif dalam memberikan gaya.
4c106eea-742a-4a61-b185-ef0610bb22c1,478ad7cd-8db6-4bb8-a202-c94d5a3fc25d,5,Desainer yang suka trading dan berkebun. Kreatif dan memberikan desain yang unik.
58474505-ad06-450c-8346-8144f94ba0e4,d5d12239-1cb2-4bc8-8226-c04fffb57071,3,Kritis dalam memberikan penilaian. Kurang suka dengan kreativitas talent ini.
5ae6c0d3-c476-46cb-899c-81225b21fc50,674c14d8-ed13-471a-aabf-ceef4e5bc44b,4,Seniman dan desainer yang sangat inovatif. Memberikan nilai tinggi untuk kreativitasnya.
f33f518c-4303-48f7-a5d7-57dbaedee6c5,d1dbc7ad-1001-4229-a463-ee3f8de759c4,5,Coder yang suka menonton. Sangat analitis dalam memecahkan masalah dan sangat berhumor.
4b739a30-6a5f-449e-ba6c-e962c90d3869,698f855c-536d-4636-835a-c1d3d8d21990,4,Penggemar bersepeda dan astronom. Sangat ramah dan suka berselancar.
1388d429-fa03-4916-b1e0-ab1c350caf8f,d7f32756-0a15-4280-9936-9f84069deeb3,3,"Programmer yang cukup riang. Kodingnya baik, tapi kurang kreatif."
e2b3f326-2cf5-4f7f-9f5c-2aa7b1525e4b,3230c4b0-ba0b-4590-8435-5e837b1f1ee7,4,Belajar dari talent ini sangat berharga. Cerdas dan memiliki cara pengajaran yang menarik.
065b6f5d-db05-402b-8da7-3451a327ac41,9a49b79e-441a-4c98-9f13-ed718e682611,5,Manajer bisnis yang sangat kritis dan perfeksionis. Solusi yang diberikan selalu tepat.
29e7cc60-2339-4a88-8ea7-73f16cc0f1ff,e8cf8206-c7eb-45cb-b17e-9ae415a7e340,3,Pengajar yoga yang ramah dan disiplin. Kurang variasi dalam mengajar yoga.
69c86fed-681a-4c10-b598-1ee03e5956c2,f80f1cf5-af8d-4eff-9e0b-278df15a1cd8,4,Astronom dan peneliti yang sangat ambisius. Bekerja dengan penuh dedikasi.
01f08fa4-f9cf-46c4-b885-fa1f92317c84,153f007d-3ecd-4b3b-8033-d8ec4c7a3dd4,5,Pembaca yang suka berjiwa petualang. Ilustrator yang sangat kreatif dan berbakat.
141ca571-5e71-47ef-b6fa-2a7c46ed4e40,484ee130-c1ee-4fa3-ace3-f50ca80443b3,4,Desainer fashion dan model yang cerdas. Kreatif dan selalu up to date dengan tren.
a49c7a70-a74a-4724-b3ca-eb48a48a68a5,375f0442-ee85-4e8d-b55f-f6edd625a025,3,Musisi yang sangat kritis dan ambisius. Karyanya memiliki ciri khas tersendiri.
bcc813a0-abc7-41d6-bd64-7534c89bd79b,48645e45-09b3-43cc-a42d-01eefd058880,4,"Seniman, fotografer, dan desainer yang sangat analitis. Karyanya selalu memukau."
9975e658-c479-4769-8832-050151e60a31,a40c164a-4218-4262-a693-0b7051b0cf02,4,Talent ini sangat ahli dalam bidang teknologi dan game. Sangat inovatif dan cerdas!
f833b8ee-d384-4a1b-898a-1eb607c364c5,8e1580d7-e778-457c-b77a-990c6a37fd70,5,Pengajar yang sabar dan berpengetahuan luas. Saya sangat suka belajar bersamanya.
011fcf88-4b46-427f-a774-6d67e2be3919,f3348f13-34d2-43f6-9c1e-af6fc33971f1,3,"Saya kurang paham dengan pemrograman, tapi talent ini mencoba menjelaskannya dengan baik."
89581954-fd0b-4e07-9307-b0c254c9c179,8662529e-4c77-4d78-9499-2cb1aba0191f,5,Talent ini hebat dalam sulap! Saya sangat terkesan dengan pertunjukannya.
9f608eaa-61f8-4de5-a651-348a61d253fa,b46ae63f-cb55-485e-9e76-1f1cc5126cbb,4,Fotografi talent ini luar biasa. Gambar-gambar yang dihasilkan sangat indah dan kreatif.
72f25843-3181-4f8b-8581-ac6f84f3098c,df943f83-aa80-4fa9-98f7-4fdb917eb87d,3,"Saya tidak terlalu tertarik dengan seni, tapi talent ini membuatnya menarik. Coba deh!"
a573819a-f0d8-4d56-a592-a130c3fc61df,429b90df-2a96-4dd5-bb7b-2cd6db827162,5,Penulis yang sangat kritis dan penuh semangat. Saya suka gaya tulisannya.
f355617b-deac-476c-8906-84d6fadbd783,5d2c5bf2-6965-4cc6-8732-10afe80d995f,4,Talent ini memiliki pengetahuan yang luas tentang manajemen. Sangat membantu.
2c4f7f0c-10ca-48dc-9949-6f62026d95a9,fc16bbc1-20ff-4fb5-96e6-9dc0f36d8a6b,2,Saya tidak terlalu suka dengan gaya musik yang dikeluarkan oleh talent ini. Kurang cocok untuk saya.
dbc4b12c-d60b-4c60-b5d2-e19a6304751a,8662529e-4c77-4d78-9499-2cb1aba0191f,4,"Sulapnya luar biasa! Saya masih mencoba memahaminya, tapi sangat menghibur."
5c8dec89-f44d-4961-b2ef-7b0563f41f37,b87f96c8-9737-4a2a-a778-3b85ad452bb3,5,Talent ini ahli dalam olahraga dan penelitian. Kombinasi yang luar biasa!
ce217286-d75f-4eaa-aa04-7bf4795ad159,8a3c89c9-f92a-4790-b516-496f92aa81d5,3,"Saya suka dengan animasinya, tapi terkadang terlalu kompleks bagi saya yang tidak begitu paham."
8063a821-a2c0-4ec7-bff1-a560c6e7b96a,d9db76d1-da55-4fff-8c9d-5de9c074f573,4,Teknologi talent ini sangat maju. Pemrograman yang dikuasai dengan baik.
f6b85508-dc80-4408-b108-b207af11b147,429b90df-2a96-4dd5-bb7b-2cd6db827162,5,Saya sangat menghargai pendekatan kritis talent ini terhadap penelitian.
ee8ada94-dc68-4950-b1e9-6f5da918d8ce,b1da1227-d4be-443b-a78e-2c759d619e10,4,Gaya seni dan desain talent ini sangat unik. Saya suka!
8eb75a61-ca9f-415b-bdca-ffc4708270b8,81f6cceb-499d-4e7c-9b0e-1015ec740887,3,"Arsitek yang sangat kreatif. Namun, tidak selalu mudah berkomunikasi dengannya."
3e9f51b1-f7dd-41df-a17c-53b3ec8896aa,57d1da47-e5f6-482c-ad94-2f66acfbcc7c,4,Seni dan fotografi talent ini sangat menginspirasi. Kreatifitasnya tidak terbatas.
0153bf4d-9a20-4dd4-bea2-1645985963ee,193aafb4-9873-4e18-be96-c9f1b9a6b470,2,"Talent ini terlalu serius dan terorganisir, kurang sesuai dengan selera saya yang lebih santai."
f0032269-937d-45f3-abdd-fdf4d4c05e38,3f28953a-0361-4379-b831-8e994274e598,5,Pecinta alam dan ilustrator talent ini sangat menyenangkan. Bergabung dengannya dalam perjalanan seru!
d0e0b687-4251-4e2f-a245-ecc60a3315fb,375f0442-ee85-4e8d-b55f-f6edd625a025,3,Kritis dalam menilai karya seni. Saya perlu membiasakan diri dengan gayanya.
60fb17ad-b781-4097-ae9f-46b571470dc1,66300a1a-d95e-45c3-b09f-4cbd05f72f65,4,Seni multimedia talent ini luar biasa. Kreativitasnya membuat saya terinspirasi.
61c7ba8e-141e-4ea8-89cb-00368f818aca,2323d4a4-f43b-45b8-976c-9ac763685e7a,5,Talent ini sangat ahli dalam berpikir analitis. Diskusi dengan dia selalu bermanfaat.
757a025e-605c-4cf4-b4c4-ceddca26c801,f3348f13-34d2-43f6-9c1e-af6fc33971f1,4,Talent ini sungguh menginspirasi saya untuk memahami dunia pemrograman. Sangat membantu!
6c49d12a-8b0c-415a-b1e2-2170f7048f7b,3f28953a-0361-4379-b831-8e994274e598,3,"Pengalaman traveling bersama talent ini cukup menyenangkan. Tetapi, tidak terlalu ahli dalam ilustrasi seperti yang saya harapkan."
e02c6760-6802-484f-b9b6-4f590c8ccf42,66300a1a-d95e-45c3-b09f-4cbd05f72f65,5,Saya sangat terkesan dengan kreativitas dan keahlian multimedia talent ini. Sungguh brilian!
e07c63f2-af9e-48eb-9401-81fd85989707,8662529e-4c77-4d78-9499-2cb1aba0191f,2,"Tidak terlalu suka dengan sulap, tetapi talent ini mencoba memberikan pertunjukan yang menarik."
29133ab2-0076-4e2b-bff2-d61e9ba197b5,57d1da47-e5f6-482c-ad94-2f66acfbcc7c,4,Seni dan fotografi talent ini membuat saya terinspirasi untuk memulai proyek fotografi sendiri. Terima kasih!
52b3c181-52d7-499c-8fa4-26c90c3c3e0a,429b90df-2a96-4dd5-bb7b-2cd6db827162,5,Kritik dan pendekatan kritis talent ini dalam penelitian sangat membantu saya berkembang. Sangat direkomendasikan!
8df41b70-b7d0-4a6a-aa99-5118793fabb3,193aafb4-9873-4e18-be96-c9f1b9a6b470,2,Tidak sepenuhnya cocok dengan talent ini yang terlalu serius dan terorganisir. Saya lebih suka sesuatu yang santai.
8fc42ab5-36d9-41b2-9fdc-3f7c01fc6d08,962d6932-2345-4a81-8935-3fec18407dbb,4,Talent ini sangat kreatif dan ahli dalam biologi. Saya suka cara dia menangkap momen saat traveling.
8fc42ab5-36d9-41b2-9fdc-3f7c01fc6d08,931c2814-1f84-404f-851a-7fb075835d95,5,"Pengajar ini luar biasa! Sangat ramah, disiplin, dan memiliki keahlian bisnis yang tinggi. Saya merekomendasikannya."
db7d1700-fd88-4867-8656-48b283e29e0e,3951cb57-16b4-4fc4-b1c6-9d4b14beb0c8,3,"Musisi ini memiliki gaya yang unik, tetapi kadang-kadang kurang terorganisir. Namun, masih layak dicoba."
0421199b-8813-4925-93d0-041f89a9708b,48455203-f083-409f-9c07-70c3a45efa23,4,Talent ini sangat romantis dan inovatif. Saya suka cara dia bekerja dan bermain catur bersamanya.
70e6e2d3-acce-4532-9d3a-ad6b69f8f516,1b18b89b-5434-422d-b2d9-294e4c64657e,5,Peneliti ini sangat ambisius dan memiliki pengetahuan yang mendalam dalam konservasi. Saya terkesan dengan dedikasinya.
6df95cf3-47b3-4325-ba8a-67daa7fb29f4,d5402612-6a20-436d-b325-b343274f2b72,4,Sangat ramah dan kreatif. Dia memiliki minat yang sama dalam membaca dan robotika. Layak dicoba!
51e4edf7-23f5-4ae6-8c8d-2e770c73ab19,96a902eb-fc45-4606-94d8-13e872ecca0f,5,"Fotografer yang luar biasa! Saya suka gaya pengajarannya, dan dia sangat kritis terhadap hasil foto. Top!"
cab04bb0-d49b-4c18-8aff-e368617fe344,e67e4913-c591-4908-82bb-818426396238,3,"Pengajar budaya yang baik, tetapi terkadang terlalu cerdas. Layak dicoba untuk pengalaman belajar yang berbeda."
7454a6bb-b693-4fbc-a4aa-0657d04d2603,21a256e8-4f49-4f37-acaf-427ebdeb0b51,4,Talent teknologi ini sangat inovatif dan memiliki visi yang tinggi. Saya suka cara dia menangani coding.
0fa8e599-b701-456f-9aa6-ea66777e465e,245759f1-781d-4509-a35b-afc915ff5a57,5,Peneliti yang brilian dan desainer grafis yang kreatif. Wibunya juga membuatnya lebih menarik. Sangat merekomendasikan!
0555721d-ce96-4592-857d-9379172cd08a,953f9d50-5471-4c09-907b-cc4f974836cb,3,"Pengajar yang baik, tetapi kadang-kadang terlalu fokus pada catur. Namun, tetap berharga untuk pengalaman belajar yang unik."
f3ac5fa9-feee-42d9-99bf-31d2e825c9e7,b87f96c8-9737-4a2a-a778-3b85ad452bb3,4,Kombinasi olahraga dan kreativitas membuatnya menarik. Dia juga seorang peneliti yang hebat. Saya senang belajar dengannya.
169a3554-c657-4b6e-9417-906ba5cc5954,8d5bf569-a9b7-433c-b19d-fc7dbe3e5cc4,5,Traveling dengan talent ini selalu menyenangkan. Dia penuh semangat dan ramah. Saya merekomendasikan pengalamannya.
1ff7ad44-ad4e-4d17-9a65-8b5f68564e54,250e36a2-917d-4838-9b5d-7b2bbe3a5067,3,"Konsultan yang baik, tetapi terkadang kurang humoris. Tetap layak dicoba untuk mendapatkan pandangan yang berbeda."
e95e2f72-26df-4643-93aa-e0e483fb102d,428d63e4-e03e-47e2-8257-2e86f169200b,4,Fashionista yang cerdas dan stylist handal. Model yang berbakat dan pengusaha yang sukses. Saya terkesan dengan keterampilannya.
fcdf44b6-e9a9-4403-8879-7bf4812ae6f5,db509fda-df86-4854-bce6-5cdeecaa5385,5,Seniman yang sangat kreatif dan cerdas. Suka cara dia mengekspresikan diri melalui karyanya. Top!
b179f3dd-1215-45f6-b975-f8de9a72472f,c524a8c4-cbca-49ea-ba23-1a79a88f98b9,3,Pengajar yang sabar dan komposer yang baik. Saya ingin dia lebih berani bereksperimen dalam musiknya.
26d57c3e-9763-4379-b3ac-75f5b0300e40,55346d91-7c51-48d6-b3a5-c58e79c76abd,4,Pengajar ramah dengan kecerdasan luar biasa. Penulis lagu yang sangat baik. Saya senang dapat belajar dari dia.
16741765-3f93-471c-a47e-c6a2a928391d,92b5ccd7-a5a8-4eea-bd5a-827be13cdc1b,5,Seni dan kreativitasnya luar biasa. Dia memiliki humor yang luar biasa dan dapat membuat setiap sesi menjadi menyenangkan.
f07b099b-bd6b-48a9-809a-aa47efbf4c61,e78110d2-feae-4802-81f5-dc226efdfd6e,4,Talent kuliner yang kritis dan suka berolahraga. Saya suka bagaimana dia menggabungkan kreativitas dalam masakan.
3d916c6d-d903-48ad-a8a4-572056c63e6d,5dbe1803-0eaa-44bb-9ae4-31457383d072,3,"Fotografer yang ambisius dengan minat kuliner. Meskipun kadang-kadang kritis, hasil akhirnya selalu memukau."
5c8dec89-f44d-4961-b2ef-7b0563f41f37,931a56d1-04c6-4216-ba88-90fff6aad1e0,4,Programmer yang ramah dan sabar. Membuat pengalaman belajar menjadi menyenangkan dan informatif.
011fcf88-4b46-427f-a774-6d67e2be3919,a39ab56e-1d23-4314-b1d9-9ca15eec389c,5,Aktor/Aktris yang luar biasa. Kreatif dan penuh semangat dalam setiap proyek. Saya senang berkolaborasi dengannya.
3cf35343-74e4-45e0-bc39-08af9e65832f,cd23fd35-8b63-494a-a86d-5e3fc768c1ce,3,"Konsultan bisnis yang baik, tetapi terlalu serius terkadang. Meskipun begitu, memiliki pengetahuan yang mendalam."
