user_id,talent_id,rating,review
614642e8-3837-4d12-a0e4-461b06506ad9,2cc66f5a-1c9e-4dc4-967b-e5b977ab42fa,4,Editor ini sangat terampil dalam pekerjaannya. Setiap revisi yang dia lakukan membawa hasil yang signifikan. Memberikan rating 4 sebagai apresiasi untuk kinerjanya yang konsisten.
dd7876ef-8066-4151-b36e-fae3fabe1849,e255773a-8c7e-47ad-9e55-0fec4a82e8d7,4,Talent ini memiliki keahlian dalam berkebun dan sastra. Kolaborasi kami menghasilkan proyek yang sangat menarik. Memberikan rating 4 untuk dedikasinya.
ac130baf-5f4e-4e97-aabb-cec6db50431b,30b39bf9-cebe-4bff-9ef8-790597d502da,5,Penyanyi ini memiliki suara yang luar biasa. Setiap penampilannya selalu memukau dan menghadirkan pengalaman yang tak terlupakan. Memberikan rating 5 tanpa ragu!
53634f49-5272-4006-b962-0536cead1e9e,3a8bad8c-4708-4292-ba40-93c8efd92f71,4,Seniman ini sangat ahli dalam menggambar dan menciptakan karya seni yang memukau. Setiap detailnya dipertimbangkan dengan baik. Memberikan rating 4 sebagai apresiasi untuk kreativitasnya.
5bef2f89-e8c9-4590-ab96-534085c8e0df,b7030114-6f10-4e83-93c1-882b2e9c704f,3,"Meskipun talent ini memiliki keahlian di bidang kuliner dan traveling, saya merasa kurang terhubung secara kreatif. Memberikan rating 3 sebagai saran konstruktif."
fff10473-c0b3-48c9-af0d-122306680570,60c22d64-ec40-43bd-927a-18a969bb8584,5,"Talent ini memiliki keahlian luar biasa dalam desain fashion dan seni. Kolaborasi kami sangat sukses, dan saya memberikan rating 5 untuk bakat kreatifnya yang mengesankan."
715db860-0a92-4f86-a94e-e3af9d874707,03d149b4-056b-4609-bc16-fc8bea09ff80,4,Penata rambut ini memiliki keahlian yang tinggi dalam menciptakan gaya rambut yang unik. Setiap desainnya selalu sesuai dengan keinginan saya. Memberikan rating 4 dengan senang hati.
2e78bdec-cb80-4ee7-b02d-ea716c63bf08,9c865f87-6e24-4564-bb58-6de1a0f25fb6,5,Seni dan kreativitas talent ini dalam menggambar sangat menginspirasi. Kolaborasi dengan dia selalu menghasilkan karya seni yang indah. Memberikan rating 5 tanpa ragu!
3f849adc-1a25-46e3-b238-5fc0229cb04e,2a335d19-d04e-454f-baf6-2399420847fe,3,"Walaupun talent ini memiliki keahlian dalam coding dan teknologi, saya berharap dia dapat lebih terbuka terhadap ide-ide baru. Memberikan rating 3 sebagai saran untuk perbaikan."
85956aba-8dcc-4865-a308-5944c6804957,8e452ec6-b175-4fdf-b3c8-c17370c6cc7b,4,Percakapan dengan talent ini selalu informatif dan mendalam. Diskusi dan pandangannya memberikan nilai tambah yang besar. Memberikan rating 4 sebagai penghargaan.
3bf05113-3454-48c9-8a38-29038502ec90,f0b8710a-7edd-4e67-a0fa-b3754bfd8576,5,Talent ini memiliki keahlian hebat dalam surfing dan ilustrasi. Proyek yang kami lakukan bersama sangat memuaskan. Memberikan rating 5 untuk dedikasi dan kreativitasnya.
9917b40a-b349-4fe7-aebd-eb8d034b7240,11eb224e-0956-4e13-93a6-ce60426a0124,4,Talent ini sangat menginspirasi. Saya suka bagaimana dia menggunakan pengetahuannya dalam sastra dan kreativitasnya dalam menulis. Sangat merekomendasikan!
a08f5013-004b-419b-bd44-c4baa440dab7,64183f98-8491-43e5-bcec-b057ae943a57,5,"Talent ini adalah guru terbaik! Desainnya luar biasa, dan dia sangat cerdas dalam membimbing. Saya sangat senang bekerja dengannya."
b692813c-bbc4-422a-acd6-2c6572fb770c,bebf03bf-4b5c-421e-b84d-b07ca1054278,3,"Codingnya bagus, tapi agak sulit dipahami untuk pemula. Mungkin perlu sedikit perbaikan dalam mendekomposisi konsep-konsepnya."
378a9000-1c0c-461c-a3c5-8f074ab952c2,73b4c3dc-e442-4f44-a242-80a070fa0de6,5,Pilihan yang sangat bagus! Sangat inovatif dalam teknologi dan cosplay. Saya benar-benar terkesan dengan kreativitasnya yang luar biasa.
741456f2-e893-4dca-bfa4-f3d0c4c2760d,1b716f0a-d95f-45fc-b46e-4443554ca3ff,4,"Penelitian yang dilakukan oleh talent ini sangat mendalam. Perfeksionis dalam setiap detail. Meskipun agak serius, dia ramah dan mudah bekerja sama."
e300791a-288d-4c28-8440-281655eb99bf,eb2db970-b3d2-4986-a2b3-f5c08818021d,4,Fashion yang dihasilkan sangat kreatif. Teknologi yang digunakan untuk membuat gamenya sangat canggih. Pekerjaan luar biasa!
b8ddebec-22f3-4fa8-8f36-665d2e34f64d,fe723804-1ed2-4551-9be4-16f1eda2236e,5,"Desain talent ini sangat indah! Sangat kreatif dan independen. Saya senang berkolaborasi dengannya, hasilnya selalu memukau."
156254d6-1190-4065-974e-d16ec00b2a1c,f8518c6a-3883-46d9-89ba-08085d853c9a,3,"Codingnya cukup baik, tapi perlu lebih fokus pada pembelajaran. Terkadang terlalu cepat dalam menjelaskan konsep-konsepnya."
fb960506-2ca6-4e41-b59a-cf4748c49f8b,9c35c311-85d9-4f44-a0cc-504675e120ab,4,Bimbingan yoga yang diberikan sangat menyenangkan. Sangat cerdas dan penuh energi. Saya belajar banyak dari setiap sesi yoga bersamanya.
6703743b-3c0f-4ebb-baba-0dc91476081e,d8ea0671-fc3f-4daf-ad31-de9ef1f1743a,5,Dokter yang luar biasa dan ramah! Bekerja sama dengannya membuat pengalaman kesehatan menjadi menyenangkan dan informatif.
0d1bb55e-980b-46b1-a0cf-b4b255940251,5f8037a6-6fa7-493b-8456-100ff1d49374,4,Talent ini memiliki semangat olahraga yang tinggi. Sangat ramah dan ambisius. Saya senang bisa belajar dari pengalaman olahraganya.
a3e53603-1cfd-439c-926e-13e6d3a9f33b,f842424e-f907-4a51-9240-a446a6fe065c,3,"Aktor yang bagus, tetapi perlu lebih berani dalam mengambil risiko. Terkadang terlalu aman dalam pilihan peran."
38b7ab1f-3724-4715-a54b-ccb2ad6107f7,b9fa6465-3fde-4095-859e-a72bce661422,5,Desainer interior yang sangat berbakat! Selalu memberikan sentuhan kreatif dan penuh semangat dalam setiap proyek.
e1c29a0e-f54b-47d7-a4e7-463601c8564d,197a7fe4-ca2e-430d-bf21-dc3929565e0e,4,Penggunaan teknologi dalam pekerjaan ini sangat inovatif. Sangat kreatif dalam membuat desain arkeologinya. Pekerjaan bagus!
5a2d11b6-21e9-47d5-849e-420cea695653,dd449733-0583-40f6-8531-9861fc8e0761,3,"Desainnya bagus, tetapi perlu lebih kritis dalam pemilihan elemen-elemen. Beberapa detail mungkin perlu ditingkatkan."
1f524ba8-9357-4f10-bde0-f00e06cdc133,423fb6bf-8d4f-4d0d-aebf-3cf110c0bf88,5,Penerjemah yang sangat ahli! Bekerja dengan talent ini membuat proyek-proyek kami lebih lancar dan mudah dipahami.
5ae9e854-9fb9-4781-8f6e-aad16e7d536e,9e7573c7-84f9-466b-9f79-b5ee81e2aeab,4,Dokter yang sangat analitis. Penelitian yang dilakukan sangat mendalam dan bermanfaat. Bekerja sama dengannya adalah pengalaman yang berharga.
04f6cf41-4102-4112-a77e-5c96adfeacfc,c6d5eb8a-c99e-4974-9ad7-4a279cbddcab,5,Kerja seni yang dilakukan talent ini sangat menginspirasi. Sangat kreatif dan percaya diri dalam setiap proyeknya.
342948fb-969e-465d-980b-3d60c591344c,d9489933-0259-4490-8613-4e5acd45e2f2,3,"Penari yang sangat ambisius! Meskipun perlu sedikit fokus pada teknik tertentu, namun kreativitasnya sangat mengesankan."
76fc6818-0340-4df0-b45b-d9bd5861bd58,de831a2d-4d6e-41aa-a092-e779003cc50f,4,Penelitian talent ini sangat mendalam. Teknologi yang digunakan dalam penelitiannya sangat canggih. Sangat merekomendasikan!
c311cc0e-5d50-4e67-95ad-dccb3bb17841,bcc2dff9-348a-4d9b-a618-6bc9c5fad384,5,Seniman yang sangat sabar dan kreatif. Bekerja dengan talent ini selalu menyenangkan dan menghasilkan karya seni yang luar biasa.
59a8620b-aead-4dcc-91c1-fcd74ab432ba,70b8125a-c8d5-4e59-af64-2e95ee7f09bf,4,Komposer yang hebat! Musik yang dihasilkannya sangat menyentuh dan bermanfaat dalam yoga. Sangat ramah dan berpengetahuan luas.
b5ce2308-5d6a-44d4-b981-7d7792a0fc70,f1c44523-81cd-4719-90a3-01efc1dc48cc,3,Pekerjaan yang dilakukan talent ini sangat independen dan kreatif. Meskipun kadang-kadang kurang fokus pada detail tertentu.
246a5d84-7cbf-458a-876e-df454ed73626,f44d87a2-305a-4a96-821e-5c0953e0acdd,5,Talent ini benar-benar lucu dan ramah! Sangat ahli dalam pengajaran dan disiplin. Sangat menyenangkan belajar bersamanya.
ca140d55-4fd9-4816-b74d-097bdfa4b706,8fa59958-c0c6-4b0b-b387-a4a2fa559392,4,Seniman talent ini sangat kreatif dan berbakat. Fotografi yang dihasilkannya selalu menakjubkan. Sangat merekomendasikan!
8b07d872-b4f4-4c33-9d47-ec15c2b044fc,182d6738-fb01-4af9-872c-e49fb422c07a,3,"Binaraga yang hebat! Program latihan sangat efektif, tetapi mungkin perlu lebih berfokus pada keberagaman olahraga."
5903bf92-6cde-4177-bde3-01554c7092ae,cff8ab44-b250-4340-9e5c-9bb6cb96a85d,5,Programmer yang sangat inovatif! Kodingnya selalu bersih dan efisien. Sangat puas dengan kerja sama ini.
7fb0d918-d136-4adb-8ce0-cfa0f9eefdad,92e241e0-627f-4e0b-8de3-5930c3825ead,4,"Codingnya sangat canggih, dan robotika yang dihasilkannya sangat impresif. Sangat merekomendasikan untuk proyek teknologi tinggi."
140dbfe1-1ee2-4df3-b9d3-513ca0ecbb1b,a88e96b9-c2d2-439e-9ace-71afddef6486,3,"Trading yang dilakukan oleh talent ini sangat baik, tetapi perlu lebih fokus pada manajemen risiko. Kreatif dalam mencari peluang."
bb488af5-baac-4968-812f-545d8310eba0,b4d122b1-e2c1-4cac-aaf8-0a2df06fd00e,5,Animator yang hebat! Kreativitas dan fleksibilitasnya sangat mengesankan. Hasil akhirnya selalu luar biasa.
48456da5-346c-4bbe-a8dd-3635a393352d,e76178e1-9165-4910-bd30-d8dd7f8b9387,4,Videografi talent ini sangat cerdas dan kreatif. Setiap proyek yang dia ambil selalu memiliki sentuhan khusus. Pekerjaan bagus!
3af0e494-9247-444d-beb1-a1c8ea55a7ba,7ca5ad83-b534-4aa7-8b55-553ed15636b5,3,Yoga instructor yang sangat ahli. Meskipun perlu lebih disiplin dalam jadwal kelasnya. Sangat bermanfaat untuk kesehatan.
902726a6-3f4e-4646-99a7-8cd7a1fa551a,065bb455-4fb1-410c-96a0-555d64751bc6,5,Pramugari yang sangat ambisius dan ramah. Bekerja dengannya selalu menyenangkan dan terorganisir dengan baik.
18f58f14-eb6c-413b-8eca-b6d4346ec32d,332b82dd-eb9a-46bd-8785-f28310580fbf,4,Penelitian yang dilakukan oleh talent ini sangat mendalam dan informatif. Sangat merekomendasikan untuk proyek penelitian.
fa760416-c64b-4ef9-97ea-fe6d7c73783b,90c8c35e-80d0-4478-8d78-9ec07e91c523,3,Pendaki yang sangat ahli. Selalu memberikan wawasan yang mendalam tentang perjalanan dan petualangan. Sangat bermanfaat!
0c95a577-a894-4c35-87db-d28ffa2167bf,8d9960c9-0043-4e98-b9fd-3b9a08ac945e,5,Desainer interior yang sangat kreatif dan ramah. Proyek-proyeknya selalu menciptakan lingkungan yang nyaman dan estetis. Sangat merekomendasikan!
52501f6d-bd5a-4e7a-b605-5895a26ec9ef,77552341-9ea2-427d-b854-501ceb0360b3,4,Seniman yang sangat riang dan kreatif. Setiap karya seninya selalu menghadirkan kebahagiaan dan keindahan. Pekerjaan luar biasa!
5290d550-2683-4e4b-95f2-f84c11e0af8c,dae5ae9f-4dbb-43c9-843f-e109ad56f556,3,Penelitian yang dilakukan oleh talent ini sangat menyentuh dan mendalam. Sangat bermanfaat untuk pemahaman budaya.
56bbd603-dc4e-4818-8dd1-8670f49b88ef,12d2d756-5079-4093-944e-c330b95c926b,5,Musisi yang sangat kreatif! Karya-karyanya selalu memukau dan menginspirasi. Sangat senang bekerja dengannya.
747dbf9a-47c3-45ab-97b2-f652c129e4bc,11eb224e-0956-4e13-93a6-ce60426a0124,5,Talent ini sangat menginspirasi saya dalam dunia sastra. Setiap karyanya begitu kreatif dan membuka mata saya terhadap berbagai ide baru. Sangat merekomendasikan!
cab0627c-5f71-41b7-aee1-828d103f4145,64183f98-8491-43e5-bcec-b057ae943a57,4,"Saya suka bagaimana talent ini mendesain dengan begitu cerdas. Pengajarannya membuat saya semakin mengerti seni desain. Namun, mungkin bisa ditingkatkan lagi."
80d43443-b5b8-4bc9-8944-6c7d69955cc4,bebf03bf-4b5c-421e-b84d-b07ca1054278,3,"Bekerja sama dengan talent ini dalam proyek coding. Meskipun cukup inovatif, terkadang sulit untuk bekerja dengannya. Perlu meningkatkan komunikasi tim."
05ddc525-e10a-40cc-b07b-2f23054d03e9,73b4c3dc-e442-4f44-a242-80a070fa0de6,5,Salah satu talent terbaik yang pernah saya temui. Keahliannya dalam teknologi dan programming sungguh luar biasa. Semua proyek menjadi lebih baik dengan kehadirannya.
fdbebfa7-e937-4204-9393-f491bb53c71b,1b716f0a-d95f-45fc-b46e-4443554ca3ff,4,"Talent ini memiliki wawasan yang dalam dalam dunia teknologi dan Kpop. Sangat menyenangkan bekerja bersamanya. Namun, terkadang kurang kritis dalam pemikiran."
a76a5b43-84aa-493a-8828-253eb169909e,eb2db970-b3d2-4986-a2b3-f5c08818021d,3,"Talent ini memiliki ide-ide inovatif dalam dunia fashion dan teknologi. Sayangnya, beberapa konsep terlalu independen dan sulit dipahami oleh khalayak umum."
46a67fde-75eb-4f8a-ada4-516d117a9d4c,fe723804-1ed2-4551-9be4-16f1eda2236e,5,Kerjasama dengan talent ini sungguh menyenangkan. Desainnya sangat kreatif dan ramah. Setiap detailnya dipertimbangkan dengan baik.
60c68d8a-f60f-4cf5-a867-ac52fc180c98,f8518c6a-3883-46d9-89ba-08085d853c9a,4,Talent yang luar biasa dalam coding dan inovasi. Pengajarannya sangat mudah dipahami dan membantu saya mengembangkan keterampilan programming saya.
82fb676e-f19e-48ce-b430-c3562c6c4a2f,9c35c311-85d9-4f44-a0cc-504675e120ab,3,"Saya belajar banyak dari talent ini dalam kesehatan dan yoga. Namun, terkadang terlalu fokus pada teori sehingga kurang praktis untuk diterapkan sehari-hari."
22f238db-deb3-4a60-a910-34aa0f996447,d8ea0671-fc3f-4daf-ad31-de9ef1f1743a,5,Talent ini adalah dokter yang sangat ramah dan berpengetahuan luas. Konsultasinya sangat membantu dan memberikan solusi yang tepat untuk masalah kesehatan saya.
54af8f05-1ace-4f5a-a7e8-3e75a8a5a00f,5f8037a6-6fa7-493b-8456-100ff1d49374,4,"Saya sangat terkesan dengan talent ini yang memiliki semangat tinggi dalam dunia olahraga dan Kpop. Bersama-sama, kami mencapai banyak pencapaian dalam berbagai kompetisi olahraga."
55ceb688-a496-4519-8643-8b2432cda0c2,f842424e-f907-4a51-9240-a446a6fe065c,3,"Bekerja sama dengan talent ini dalam proyek film. Aktingnya sangat baik, tetapi terkadang kurang percaya diri dalam mengekspresikan emosi yang mendalam."
bae2137d-db18-4120-a9f3-b17c851ff94d,b9fa6465-3fde-4095-859e-a72bce661422,5,"Talent desainer interior yang sangat berbakat. Setiap detailnya dipikirkan dengan matang, menciptakan lingkungan yang nyaman dan estetis. Sangat merekomendasikan!"
9ed21392-b441-4d90-af6a-795df4bc0a70,197a7fe4-ca2e-430d-bf21-dc3929565e0e,4,"Saya suka bagaimana talent ini menciptakan desain arkeologis yang menggabungkan keindahan dan fungsionalitas. Namun, beberapa konsep terlalu ambisius."
5fdc6556-0057-4d59-8729-81ea8ad7264c,dd449733-0583-40f6-8531-9861fc8e0761,3,"Saya dan talent ini bekerja sama dalam pengembangan teknologi dan programming. Meskipun memiliki ide yang inovatif, terkadang kurang fokus pada implementasi praktis."
9ac955cc-8f8f-4ef4-bf36-7a7b0c036558,423fb6bf-8d4f-4d0d-aebf-3cf110c0bf88,5,Salah satu talent terbaik dalam dunia seni. Kreativitasnya tanpa batas dan kemampuannya dalam menggabungkan berbagai konsep sangat mengesankan.
010c2481-fe00-4a0b-8069-fd6f2e32813e,9e7573c7-84f9-466b-9f79-b5ee81e2aeab,4,"Talent ini memiliki keahlian dalam menari dan seni. Namun, terkadang terlalu perfeksionis dan sulit untuk memutuskan konsep yang ingin diusung."
d129126e-11d5-4368-bcdf-5c5da968fe0f,de831a2d-4d6e-41aa-a092-e779003cc50f,3,"Bekerja sama dengan talent ini dalam pengembangan teknologi. Meskipun memiliki ide yang inovatif, tetapi kurang kritis dalam mengevaluasi solusi."
1ffdf87b-f398-409f-a5eb-548a14732521,bcc2dff9-348a-4d9b-a618-6bc9c5fad384,5,"Sangat senang bekerja dengan talent ini. Seniman yang sabar dan kreatif, mampu menghasilkan karya yang memukau dan memberikan kesan mendalam."
91a515ee-e790-44a9-84b2-d05ea2382673,70b8125a-c8d5-4e59-af64-2e95ee7f09bf,4,Talent ini sangat ahli dalam desain arsitektur dan yoga. Pengajarannya sangat membantu dalam memahami keseimbangan antara fungsi dan estetika.
65709718-c0fa-4d0d-b559-d01f3329ca2e,f1c44523-81cd-4719-90a3-01efc1dc48cc,3,"Bekerja sama dalam proyek kuratorial dan seni. Talent ini memiliki visi yang kuat, namun terkadang kurang ramah dan sulit beradaptasi dengan ide-ide baru."
7dae993d-e16a-43fb-9b7b-431f5dcbb71f,f44d87a2-305a-4a96-821e-5c0953e0acdd,5,"Salah satu talent terbaik yang pernah saya temui. Humoris, disiplin, dan kritis dalam setiap aspek pekerjaannya. Semua proyek menjadi lebih baik dengan kehadirannya."
02e33b9e-5337-4ef7-a47d-461506de968b,8fa59958-c0c6-4b0b-b387-a4a2fa559392,4,Suka bagaimana talent ini menggabungkan seni dan konservasi dalam desain interior. Kreatif dan peduli lingkungan. Sangat merekomendasikan!
169a5b24-1bdc-478e-9b17-0afd1ff4e127,182d6738-fb01-4af9-872c-e49fb422c07a,3,"Bekerja sama dalam proyek 3D modelling dan arsitektur. Talent ini memiliki ide yang bagus, tetapi kurang fleksibel dalam menerima ide-ide baru."
cf5ea9ad-6d39-4fa7-818d-2800d09804ee,cff8ab44-b250-4340-9e5c-9bb6cb96a85d,5,Talent coding yang sangat inovatif. Setiap proyek yang dikerjakannya selalu memukau dan menghadirkan solusi yang unik. Sangat merekomendasikan!
f7126372-be85-4023-94eb-a9dbd2bb99cb,92e241e0-627f-4e0b-8de3-5930c3825ead,4,Saya suka bagaimana talent ini menggabungkan fashion dan travelling dalam setiap desainnya. Kreativitasnya tidak terbatas dan selalu memberikan kejutan.
ebe000eb-100d-4592-bbcf-bd7e86a4f8eb,a88e96b9-c2d2-439e-9ace-71afddef6486,3,"Talent ini memiliki keahlian dalam ahli ekologi dan trading. Meskipun memiliki visi yang kuat, terkadang sulit untuk bekerja sama dalam tim."
b8dc8b43-4c6c-4792-884a-f978d606bfe7,b4d122b1-e2c1-4cac-aaf8-0a2df06fd00e,5,Salah satu talent terbaik dalam dunia animasi. Setiap karyanya memiliki keunikan dan daya tarik tersendiri. Sangat merekomendasikan!
402e7580-5af5-470c-a985-1c0078dc94d9,e76178e1-9165-4910-bd30-d8dd7f8b9387,4,Talent ini memiliki wawasan yang dalam dalam dunia diskusi dan videografi. Setiap proyek yang dihasilkannya selalu menginspirasi dan mendalam.
a3e915d7-9bbf-4278-ae71-ba753271307e,7ca5ad83-b534-4aa7-8b55-553ed15636b5,3,"Bekerja sama dalam proyek yoga dan olahraga. Meskipun memiliki pengetahuan yang baik, kurang inovatif dalam menciptakan konsep-konsep baru."
33bd8c5c-ae10-4e22-980e-a35dbdea9dbc,065bb455-4fb1-410c-96a0-555d64751bc6,5,Talent pramugari yang sangat ambisius. Eksperimennya dalam dunia olahraga sungguh menginspirasi. Sangat merekomendasikan!
79c0532c-a319-4788-948d-d56f1313ec12,332b82dd-eb9a-46bd-8785-f28310580fbf,4,Saya suka bagaimana talent ini optimis dan kreatif dalam fotografi. Setiap karyanya memiliki sentuhan pribadi yang membuatnya unik.
4e845355-46da-400d-a68c-dff096744936,90c8c35e-80d0-4478-8d78-9ec07e91c523,3,"Bekerja sama dalam proyek pendakian dan fotografi. Meskipun memiliki passion yang kuat, terkadang kurang kritis dalam memilih konsep yang sesuai."
585f40e3-c761-436d-b89b-282c5c8dae13,8d9960c9-0043-4e98-b9fd-3b9a08ac945e,5,Talent ini memiliki keahlian yang luar biasa dalam mendaki dan desain interior. Setiap proyeknya selalu menciptakan atmosfer yang unik dan nyaman.
bdb10b12-76fd-4bf7-8b3d-dfa11b1ced33,77552341-9ea2-427d-b854-501ceb0360b3,4,Bekerja sama dalam proyek kuratorial dan seni. Talent ini memiliki kecerdasan dan kreativitas yang tinggi. Semua proyek menjadi lebih berwarna dengan kehadirannya.
2917d9a6-7361-450f-9eea-7c2ea58c432f,dae5ae9f-4dbb-43c9-843f-e109ad56f556,3,"Talent ini memiliki keahlian dalam seni dan romantis. Meskipun kreatif, terkadang kurang fleksibel dalam menerima ide-ide baru."
91feab71-db8c-4bd7-87da-ccf38ef9cdac,12d2d756-5079-4093-944e-c330b95c926b,5,Salah satu talent terbaik dalam dunia musik. Kreativitasnya tanpa batas dan kemampuannya dalam menggabungkan berbagai genre sangat mengagumkan.
06cd436f-a3a3-4903-bb73-af3f70f704c4,6cc2e5c1-1bc4-4b42-8d84-26135a77709a,4,Suka bagaimana talent ini menciptakan solusi kreatif dalam dunia coding dan programming. Pengajarannya sangat membantu dan mendalam.
b841d577-35fa-4f2a-9f7b-7c14caf3947f,5914ab27-c5d8-4a91-be53-598bb190794e,3,"Bekerja sama dalam proyek fashion dan traveling. Meskipun memiliki keahlian yang kuat, terkadang kurang kritis dalam pemilihan konsep yang sesuai."
37119d81-c673-44c5-82ef-cf13f006f764,2da79e84-bcc7-4690-a5ac-73a37723ae21,5,Talent ini memiliki visi yang kuat dalam teknologi dan programming. Setiap solusi yang dihasilkannya selalu memukau dan efektif. Sangat merekomendasikan!
5e88257f-aad0-4fc6-af33-9ff05e0b60e0,109dd457-1c4c-4f1d-a574-948f4844204e,4,"Bekerja sama dalam proyek coding dan inovasi. Talent ini memiliki pemahaman yang mendalam dalam teknologi. Namun, terkadang kurang ramah dalam berkomunikasi."
b21f7f8f-16b1-4d4b-a8c3-4b3daf8f3b81,59844adb-3b0f-4ad8-8aca-0fb761c5b6ba,3,"Saya suka bagaimana talent ini menciptakan solusi inovatif dalam dunia robotika. Namun, terkadang kurang fokus pada detail dan implementasi praktis."
881f8fdb-5c9a-4ba3-8aa2-e46c051b1c22,3d633317-d8f8-4d45-ac26-d62dca57d224,5,Talent editor yang sangat berbakat. Setiap proyek yang diselesaikannya selalu memenuhi standar tertinggi. Sangat merekomendasikan!
e9edce34-e36c-4028-a1c5-4292b865d0f3,89341cbe-65d3-46bd-b905-32becfbbf0a4,4,Bekerja sama dalam proyek manajemen dan dermawan. Talent ini memiliki integritas yang tinggi dan selalu berusaha memberikan dampak positif pada masyarakat.
ee5c6302-584b-4e77-bb27-3abab72a0228,4324ca33-e1b0-4693-8b66-5b48bef51e4d,3,"Suka bagaimana talent ini membantu dalam pengembangan teknologi dan arsitektur. Namun, terkadang kurang fleksibel dalam menerima ide-ide baru."
ede2bff8-0138-4811-9eac-81918a778770,97ff9e71-466d-4b01-bb9e-7167d8035fd9,5,Talent ini memiliki wawasan yang dalam dalam dunia membaca dan sastra. Setiap karyanya memiliki kedalaman makna dan nilai estetika yang tinggi. Sangat merekomendasikan!
afcde177-61a3-4636-ae97-6693b6cd3c7b,3c20c6ad-827a-4732-8a53-443b60693120,4,Bekerja sama dalam proyek kuratorial dan seni. Talent ini memiliki kreativitas dan seni yang tinggi. Semua proyek menjadi lebih berwarna dengan kehadirannya.
2d353943-a35f-4702-be68-2c1ba128fcdd,2590c3a6-5b61-49b6-971a-29422683070b,3,"Talent ini memiliki visi yang kuat dalam desain dan seni. Namun, terkadang kurang ramah dalam berkolaborasi dengan orang lain."
647c28ed-33da-4012-b21e-e444400503d6,2a4b5b55-fabb-4dcc-9588-f1dab07e9225,5,Salah satu talent terbaik yang pernah saya temui. Setiap proyek yang dihasilkannya selalu menciptakan dampak positif dan menginspirasi. Sangat merekomendasikan!
67d23d87-8c21-4cce-9e81-918c0cd4ac49,97ff9e71-466d-4b01-bb9e-7167d8035fd9,4,Suka bagaimana talent ini menciptakan solusi inovatif dalam dunia desain dan 3D modelling. Pengalaman bekerja dengannya sangat menyenangkan dan mendidik.
d3b3c2a6-337a-43cf-bafa-42627d83c16d,8fae7796-c218-438c-8997-0b02453d54ca,4,Saya sangat terkesan dengan desain arsitekturnya yang kreatif dan terorganisir. Sangat merekomendasikan!
b6661873-58a5-469f-855c-b81c97a4e057,4a287f86-41c7-493d-a5c4-568fe6ae88f3,5,Talent ini benar-benar inovatif dan memiliki pemahaman yang mendalam tentang teknologi. Pelayanan pelanggan yang luar biasa!
5be54304-7ef4-4faf-8cfe-52ef8214b604,63033218-389c-4377-854c-dd415337b623,3,"Editor ini memiliki gaya yang kreatif, tetapi terkadang kurang disiplin dalam memenuhi tenggat waktu."
cd477633-133d-4157-8bd9-51366645709d,494eac09-90fe-4288-a4c2-5afd32f0dc7c,4,Seniman yang sangat kreatif dan visioner. Suka menolong dan selalu memberikan yang terbaik dalam karyanya.
b800ee4e-c78e-4eb6-bbd6-63a0187843fb,7dc481ba-a908-42a3-8fad-08467e8bbfd2,5,Koki ini hebat! Mampu mengambil gambar yang luar biasa dan memiliki keberanian pemadam kebakaran. Top!
6d1335fc-e1a5-4298-be97-0c10cc5fff39,43fd7789-be5c-4324-9f44-a6b241b1fec1,4,"Ambisius, inovatif, dan jago coding. Teknologinya sangat mengesankan. Selalu memberikan solusi yang kreatif!"
02a3d0c2-a826-4208-bc54-cb23f8cc5983,fc0f6e4b-c397-40a4-a24c-d08b92aedc45,3,"Talent ini memiliki hobi yang beragam, seperti badminton dan hiking. Cukup menyenangkan, tetapi butuh lebih banyak keterampilan dalam bermain olahraga."
45cae9ea-12f3-452e-b6bb-dfa5b6993e2a,a56f1872-7588-4046-a283-a6da5f3bf98d,5,Pengalaman sangat baik dengan talent ini. Sangat ramah dan terampil dalam bidangnya. Selalu memberikan yang terbaik!
f718047f-9250-4caf-936c-1cf37d418784,ac67cba9-6a1b-42c0-adc0-6fe5dd3591c2,4,"Binaraga yang bermain musik! Kombinasi yang unik dan menarik. Penampilannya luar biasa, tetapi sedikit kurang dalam disiplin."
111ac480-b07a-4138-82b2-1679ba323041,ce3d0a7a-98fc-4381-965e-77e533b4e20a,5,Pengajar yang sangat sabar dan berkomitmen. Mampu mengajarkan yoga dengan baik dan memberikan tips kesehatan yang bermanfaat. Sangat puas!
33291b26-237b-4215-897e-41a587c561c7,8fae7796-c218-438c-8997-0b02453d54ca,4,Desain yang luar biasa dan kreatif. Arsitektur yang diberikan sangat terorganisir. Karya yang dihasilkan selalu memukau.
76537dcd-f0e5-4c2f-8c04-25cca4c24127,43fd7789-be5c-4324-9f44-a6b241b1fec1,3,"Sangat ambisius dan inovatif, tetapi terkadang kurang dalam humor. Perlu menambahkan sentuhan keceriaan pada pekerjaannya."
567ce7f3-a5a8-4173-b9fd-0ee9f8ce5fc3,7dc481ba-a908-42a3-8fad-08467e8bbfd2,5,Pramugari yang memiliki talenta luar biasa dalam fotografi. Pelayanannya sangat baik dan selalu memberikan pengalaman yang menyenangkan!
f0060d32-c7d6-443f-8d64-546f34201276,494eac09-90fe-4288-a4c2-5afd32f0dc7c,4,Seniman visioner yang suka menolong. Kreativitasnya luar biasa dan selalu bersedia memberikan dukungan kepada orang lain.
2a01ea30-3d65-420d-9b39-f31975d7863a,63033218-389c-4377-854c-dd415337b623,3,"Editor yang kreatif, tetapi terkadang kurang disiplin dalam hal tenggat waktu. Memerlukan peningkatan dalam manajemen waktu."
7b34bc3e-537d-4d76-ae54-0a815c84a7b7,277c75d7-c903-4948-967d-ca47ca8942f9,4,Multimedia artist yang sangat visioner. Desain grafisnya luar biasa dan selalu menciptakan konten yang menarik.
f665b8c1-b0b3-453a-a1f3-ed488c2c85c5,fb8b5217-0ddd-41b2-9224-57c9d933f1f0,5,Psikolog yang berbakat dalam mendaki dan olahraga. Teknologi menjadi daya tarik tambahan dalam pekerjaannya.
05484b18-6387-4a1b-8da7-51c67d48d2e2,dd8dc271-1915-4700-b1b8-e7533323f9a8,3,"Percaya diri dan berjiwa petualang, namun terkadang kurang disiplin. Membutuhkan lebih banyak fokus pada pekerjaan."
4061ea4d-cb75-402e-9a05-dd567c15c66c,a56f1872-7588-4046-a283-a6da5f3bf98d,5,Editor yang sangat disiplin dan kreatif. Memberikan sentuhan yang unik pada setiap proyeknya.
f0c6584e-7479-4679-ba8d-693471278740,34b384a4-cbb9-4e39-9f85-8b80423df524,4,"Talent ini memiliki desain yang sangat inovatif. Saya sangat senang bekerja dengannya. Namun, masih ada beberapa aspek yang bisa ditingkatkan."
